userId,content,boughtTime,voteCount,replyCount,starStep,creationTime,referenceName
22010789257,vivo x200 pro超级好看！！逛街在实体店看到就觉得外形很好看，上午下单两个小时就到了，实物拿在手里非常有分量，性能配置也非常高，好评好评！,2024-12-26 11:23:32,0,1,5,2024-12-26 17:05:36,vivo X200 Pro 12GB+256GB 钛色 国家补贴 蔡司2亿APO超级长焦 蓝晶×天玑9400 6000mAh蓝海电池手机
22181940549,我刚入手vivo X200不久，真的太满意了！它的外观设计简直长在我的审美点上，轻薄的机身，握在手里大小正合适，而且那种精致的工艺，让手机看起来特别有质感。每次拿出来都感觉很有面子。性能方面更是没得说，不管是玩大型游戏还是同时运行多个应用程序，都非常流畅，一点都不卡顿。拍照功能更是惊艳到我了，上次出去旅游，随手拍的照片都特别好看，色彩还原度高，细节也很清晰，感觉自己都快成摄影大师了。续航也能满足我的日常使用，再也不用担心手机没电的尴尬了。总之，vivo X200真的是一款各方面都很出色的手机，强烈推荐！,2024-12-25 11:45:42,0,1,5,2025-01-12 13:57:10,vivo X200 Pro 12GB+256GB 钛色 国家补贴 蔡司2亿APO超级长焦 蓝晶×天玑9400 6000mAh蓝海电池手机
22005319354,手机收到了，很漂亮，性能超级棒，软件打开很快，很流畅，拍照功能很强，远景非常清晰，颜色也很正，5G 信号很好，非常好的手机，满意这个产品,2024-12-19 23:19:06,0,1,5,2024-12-25 17:37:29,vivo X200 Pro 12GB+256GB 钛色 国家补贴 蔡司2亿APO超级长焦 蓝晶×天玑9400 6000mAh蓝海电池手机
21996566049,反应速度超快无卡顿，触摸灵敏无误触，相机对于非专业用户开始足够用了，最最重要的是自动亮度调光比隔壁o强一百倍，完全可以当主力机使用，感谢vivo 提供这么好的产品！,2024-12-20 20:33:18,0,1,5,2024-12-24 07:41:24,vivo X200 Pro 12GB+256GB 钛色 国家补贴 蔡司2亿APO超级长焦 蓝晶×天玑9400 6000mAh蓝海电池手机
21918676705,物流真的好快，下午拍的手机，第二天早上就到手了。果然黑色不会出错，非常好看，还是磨砂面的，后置摄像头好大，拍摄效果很棒，还有长焦微距，也有4k120帧的视频拍摄，人像拍照很好，系统运行速度很快，续航很顶，信号也不错。,2024-12-07 13:21:25,0,1,5,2024-12-09 21:26:51,vivo X200 Pro 12GB+256GB 钛色 国家补贴 蔡司2亿APO超级长焦 蓝晶×天玑9400 6000mAh蓝海电池手机
22059555587,"外观上，时尚大气，拿在手里很有质感。摄像头模组设计独特，不仅美观还极具辨识度。
 
性能方面，搭载的天玑9300处理器太强大了，运行流畅丝滑，多任务处理轻松应对。无论是日常刷网页、玩游戏，都毫无压力。
 
拍照更是一绝。后置5000万像素主摄，成像清晰细腻，色彩还原度高。夜景模式下，拍出的照片暗部细节丰富，噪点控制得很好。光学防抖也让拍摄更加稳定。
 
电池续航也不错，能满足一天的正常使用。充电速度快，短时间就能充满。",2025-01-02 17:06:22,0,1,5,2025-01-03 17:38:46,vivo X200 Pro 12GB+256GB 钛色 国家补贴 蔡司2亿APO超级长焦 蓝晶×天玑9400 6000mAh蓝海电池手机
21920936608,"外形外观：外形流畅，机身颜色好看
拍照效果：冲着拍照效果来的，非常好
运行速度：非常流畅，使用体验很好
屏幕音效：赞",2024-12-09 20:11:31,0,1,5,2024-12-10 11:30:57,vivo X200 Pro 12GB+256GB 钛色 国家补贴 蔡司2亿APO超级长焦 蓝晶×天玑9400 6000mAh蓝海电池手机
21951895722,买OVOiX200手机今天终于到手了，感觉很不错，手机外观漂亮手机屏幕都很流畅，网速快，手机照相机清晰，手机各个方面都很优秀，很好使用,2024-12-15 14:12:08,0,1,5,2024-12-16 14:11:23,vivo X200 Pro 12GB+256GB 钛色 国家补贴 蔡司2亿APO超级长焦 蓝晶×天玑9400 6000mAh蓝海电池手机
22252452359,看了这款手机很久，还是选择了这款钛色的 ，拿到手里好看 外观惊艳 ，屏幕大 、也不重 、还配有蔡司超长长焦 色彩鲜艳 画质清晰 电池大 续航持久 真的爱了 .系统也流畅 、真的是旗舰机.,2025-01-11 16:11:31,0,1,5,2025-01-16 21:00:27,vivo X200 Pro 12GB+256GB 钛色 国家补贴 蔡司2亿APO超级长焦 蓝晶×天玑9400 6000mAh蓝海电池手机
22006078882,"期待已久手机终于到手了，丝滑流畅，拍照方面真的优秀，画质清晰，潜望式长焦镜头，远距离也能拍的很清楚
待机时间：待机时间也很长中午开箱50％现在都还有26％杠杠的
运行速度：处理器搭载天玑9400，不必过多赘述，丝滑流畅",2024-12-24 19:31:12,0,1,5,2024-12-25 20:10:48,vivo X200 Pro 12GB+256GB 钛色 国家补贴 蔡司2亿APO超级长焦 蓝晶×天玑9400 6000mAh蓝海电池手机
21898771354,这x200pro是我之前的x100pro版用了保值换新，今年新购的，之前还担心这个服务使用过程中有问题，结果挺靠谱的，京东合作的爱回收也很靠谱。 X200Pro最让我看重的就是他的电池又进步了，之前那款电池用的很满意。其他方面平稳升级。已经习惯了vivo的系统了，别的系统都不喜欢用了。 Vivo 200pro的拍照也很难有对手，总体满意。,2024-12-04 10:48:47,0,1,5,2024-12-05 20:12:05,vivo X200 Pro 12GB+256GB 钛色 国家补贴 蔡司2亿APO超级长焦 蓝晶×天玑9400 6000mAh蓝海电池手机
22059071828,"拍照清晰运行畅快续航很好
手机很漂亮，我很喜欢。拍照效果很好，超满意。系统运行也流畅，我买手机都买旗舰机的。今年对比了各家比较高端的手机，还是觉得x200pro
各方面符合我得需求。",2025-01-01 10:23:56,0,1,5,2025-01-03 17:06:21,vivo X200 Pro 12GB+256GB 钛色 国家补贴 蔡司2亿APO超级长焦 蓝晶×天玑9400 6000mAh蓝海电池手机
22140971656,"外形外观：后背的摄像机组非常强大，手感很敦实
拍照效果：X200 Pro的拍照效果毋庸置疑
待机时间：超大蓝海电池，待机一天毫无压力",2024-12-31 00:42:12,0,1,5,2025-01-09 12:25:41,vivo X200 Pro 12GB+256GB 钛色 国家补贴 蔡司2亿APO超级长焦 蓝晶×天玑9400 6000mAh蓝海电池手机
21943140297,沙色很有质感，是哑光的，手机试用很流畅，拍照一如既往牛，试拍的十倍焦距照片依然分毫毕现，人像135新焦距特写也很棒，手机摄影爱好者必入,2024-12-13 15:29:23,0,1,5,2024-12-14 14:38:34,vivo X200 Pro 12GB+256GB 钛色 国家补贴 蔡司2亿APO超级长焦 蓝晶×天玑9400 6000mAh蓝海电池手机
21608435390,拍照有炫光 客服叫我用手挡 笑死我了 又不能退 又不承认设计有问题,2024-10-15 21:37:23,56,20,1,2024-10-22 15:51:58,vivo X200 Pro 12GB+256GB 钛色 国家补贴 蔡司2亿APO超级长焦 蓝晶×天玑9400 6000mAh蓝海电池手机
22320628897,刚入手VIVO X200PRO，用起来感觉很不错！外观好看，性能流畅，拍照清晰，音质很棒，续航也很给力，叠加国补后，性价比超高，很值得入手！,2025-01-18 10:49:40,0,0,5,2025-01-25 22:49:36,vivo X200 Pro 12GB+256GB 钛色 国家补贴 蔡司2亿APO超级长焦 蓝晶×天玑9400 6000mAh蓝海电池手机
22026367337,这款手机非常出色，外观美观，拍照清晰，内存充足。同时，屏幕质量高，尺寸大，观影效果极佳，用起来目前没有发热的情况。,2024-12-27 21:21:28,0,1,5,2024-12-29 19:19:19,vivo X200 Pro 12GB+256GB 钛色 国家补贴 蔡司2亿APO超级长焦 蓝晶×天玑9400 6000mAh蓝海电池手机
22083161594,"外形外观：大大的摄影模组很有辨识度 本身带了一个透明的手机壳 手感不错配上我自己买的一个手机壳也很好看
屏幕音效：屏幕看着很舒服 音效也不错
拍照效果：太赞了！不愧是拍照神器
待机时间：正常一天完全没问题 我中度玩
运行速度：很快",2025-01-02 10:05:28,0,1,5,2025-01-05 21:49:07,vivo X200 Pro 12GB+256GB 钛色 国家补贴 蔡司2亿APO超级长焦 蓝晶×天玑9400 6000mAh蓝海电池手机
22178679387,"外形外观：后壳模组很大，一看就是拍照很好，
屏幕音效：屏幕也是国产顶级的非常棒
拍照效果：拍照绝对第一梯队，舞台模式 10x变焦
运行速度：运行速度嘎嘎快
待机时间：待机续航不解释，很长时间",2025-01-10 20:20:49,0,0,5,2025-01-12 10:10:26,vivo X200 Pro 12GB+256GB 钛色 国家补贴 蔡司2亿APO超级长焦 蓝晶×天玑9400 6000mAh蓝海电池手机
21899144764,用了两天 整体使用还可以 手感OK  外观沉稳大气   系统流畅  特别喜欢这超大的镜头模组  拍照色彩 清晰  相当奈斯,2024-12-02 13:01:59,0,1,5,2024-12-05 21:04:13,vivo X200 Pro 12GB+256GB 钛色 国家补贴 蔡司2亿APO超级长焦 蓝晶×天玑9400 6000mAh蓝海电池手机
22027194666,主要看重后置主摄采用5000万像素索尼LYT-818传感器，大底大光圈，成像清晰、色彩饱满、背景虚化自然。蔡司2亿像素APO超级长焦镜头，支持长焦微距拍摄，还具备OIS防抖技术和专业级防抖算法,2024-12-29 09:54:56,0,1,5,2024-12-29 21:45:21,vivo X200 Pro 12GB+256GB 钛色 国家补贴 蔡司2亿APO超级长焦 蓝晶×天玑9400 6000mAh蓝海电池手机
21995305016,"第一台平板手机就是vivo 直到现在没换过其他品牌 X200pro拍照绝绝子                                       外观手感：很好看，手感很不错
拍照效果：特别好
充电续航很久很满意游戏体验感完美感觉比iQOO好用多了",2024-12-20 22:07:40,0,1,5,2024-12-23 21:04:12,vivo X200 Pro 12GB+256GB 钛色 国家补贴 蔡司2亿APO超级长焦 蓝晶×天玑9400 6000mAh蓝海电池手机
21926446421,"发货很快，确定是正品，物流也很快，整体使用感很好，还有赠品
外形外观：漂亮，颜色要比我想的好看。
拍照效果：很好，很清晰
待机时间：很长，电池不错",2024-12-05 00:52:49,0,1,5,2024-12-11 11:52:27,vivo X200 Pro 12GB+256GB 钛色 国家补贴 蔡司2亿APO超级长焦 蓝晶×天玑9400 6000mAh蓝海电池手机
22114216819,第一次使用vivo手机，对各项功能还是很期待的拍照是亮点，手感很不错，运行速度还可以，音效不错，下单后送货很快，自己安装也方便，,2025-01-01 10:56:38,0,0,5,2025-01-06 22:57:06,vivo X200 Pro 12GB+256GB 钛色 国家补贴 蔡司2亿APO超级长焦 蓝晶×天玑9400 6000mAh蓝海电池手机
22046891923,手机已经用了一段时间了，很久没用旗舰机了，之前的iQOO5Pro换过来的，很喜欢橘子系统，个人觉得配得上今年的影像旗舰，屏幕观感也很不错，我这块是京东方的屏。影像和续航绝对稳稳的第一梯队，很喜欢,2024-12-04 21:07:14,0,1,5,2025-01-02 16:42:34,vivo X200 Pro 12GB+256GB 钛色 国家补贴 蔡司2亿APO超级长焦 蓝晶×天玑9400 6000mAh蓝海电池手机
22142320248,"终于入手vivo X200 Pro，外观时尚精致，拍照效果超绝，夜景拍摄更是一绝。天玑 9300 芯片加持，运行流畅不卡顿，爱了！
必须夸夸vivo X200 Pro！2K 超视网膜屏显示超清晰，自研影像芯片拍照色彩还原度高，大电池续航无忧，体验感拉满。
vivo X200 Pro太出色了！蔡司镜头拍风景人像都超美，充电速度快，系统操作顺滑，用起来省心又舒心，值得推荐！",2025-01-08 14:47:08,0,1,5,2025-01-09 14:29:59,vivo X200 Pro 12GB+256GB 钛色 国家补贴 蔡司2亿APO超级长焦 蓝晶×天玑9400 6000mAh蓝海电池手机
21950132908,"外形外观：好看大气外观好好看
拍照效果：不愧是x200pro拍照就是牛
运行速度：超快不卡顿
待机时间：6000毫安电池很耐用",2024-12-15 10:52:13,0,1,5,2024-12-16 08:28:56,vivo X200 Pro 12GB+256GB 钛色 国家补贴 蔡司2亿APO超级长焦 蓝晶×天玑9400 6000mAh蓝海电池手机
22014926045,"外形外观：外观大气，蓝色也是非常的正
拍照效果：pro极佳的拍摄能力无敌，超级长焦镜头强的一批
运行速度：天玑处理器9400性能能效强，天玑调教看蓝厂
其他特色：蓝心小v超级好用，也非常",2024-12-26 11:05:59,0,1,5,2024-12-27 12:35:32,vivo X200 Pro 12GB+256GB 钛色 国家补贴 蔡司2亿APO超级长焦 蓝晶×天玑9400 6000mAh蓝海电池手机
22185657904,"手机使用流畅，外观也漂亮，手机拍照是一个亮点，照片质量很好。

这几天使用了刚入手的这款手机，真的让我特别满意😉

首先，外观颜值十分惊艳。手机的机身线条流畅，拿在手里的握持感很舒适。屏幕分辨率相当高，显示效果非常清晰，色彩饱和度也很棒，无论是看视频还是浏览图片，都能给人震撼的视觉享受😍

性能方面更是没得说。各种应用程序的反应速度超快，多任务处理毫无压力。运行大型游戏的时候也很流畅，没有出现任何卡顿现象。电池续航能力也很强，即使重度使用了一天，到晚上的时候还有剩余电量，充电速度也相当快，可以快速补充电量继续使用🤗

拍照功能也让我印象深刻。摄像头的像素非常高，拍摄出来的照片清晰度极高，而且色彩还原很真实。夜景拍摄更是出色，能够捕捉到夜色中的美丽细节，对于喜欢拍照的我来说简直是福音🤳

另外，手机的操作系统简约易用，各种功能一目了然，操作起来十分便捷👍总的来说，这款手机在各个方面的表现都超乎我的预期，性价比很高，非常推荐大家购买👏",2025-01-10 19:57:47,0,1,5,2025-01-12 18:22:02,vivo X200 Pro 12GB+256GB 钛色 国家补贴 蔡司2亿APO超级长焦 蓝晶×天玑9400 6000mAh蓝海电池手机
21914303914,"手机很好用，功能性价比高，入手的金属边框很漂亮，镜头很大，相当于一个相机，有相机需求的，非常推荐。玩游戏也很流畅 ，可以根据自己的需要调整想要的画面，质感很好，性能优化和细节处理都做得很好，
屏幕音效：很好
拍照效果：蔡司的技术不用说，长焦人像功能更是杠杠滴",2024-12-06 13:31:05,0,1,5,2024-12-09 08:34:07,vivo X200 Pro 12GB+256GB 钛色 国家补贴 蔡司2亿APO超级长焦 蓝晶×天玑9400 6000mAh蓝海电池手机
21984459717,宝蓝色X200pro非常漂亮，在光影的流动下可以看丝绒般的线条，全面屏的显示几乎看不到边线，触屏的操作非常丝滑，拍照效果巨佳，爱了爱了,2024-12-22 16:48:15,0,1,5,2024-12-22 18:42:55,vivo X200 Pro 12GB+256GB 钛色 国家补贴 蔡司2亿APO超级长焦 蓝晶×天玑9400 6000mAh蓝海电池手机
22110464472,"以旧换新：非常迅速好评
外形外观：好看大气
屏幕音效：非常好屏幕
拍照效果：拍照顶级没有对手
运行速度：飞快快的飞起
待机时间：一天不用充电
其他特色：照相牛伯羿",2025-01-03 22:03:34,0,1,5,2025-01-06 20:35:41,vivo X200 Pro 12GB+256GB 钛色 国家补贴 蔡司2亿APO超级长焦 蓝晶×天玑9400 6000mAh蓝海电池手机
22024390297,好久没用vivo了，这个vivo真是长在了我得心巴上，在设计外观性能上都非常出色，真的很好用，一点不卡，还有拍照巨好看啊,2024-12-06 22:14:50,0,1,5,2024-12-29 12:15:26,vivo X200 Pro 12GB+256GB 钛色 国家补贴 蔡司2亿APO超级长焦 蓝晶×天玑9400 6000mAh蓝海电池手机
22071709603,这款手机拍照效果非常好，清晰度很高，运行流畅，速度很快，充电速度快，手机颜色漂亮，还有独特的颜色，整体表现非常出色。,2025-01-04 16:16:03,0,1,5,2025-01-04 21:32:20,vivo X200 Pro 12GB+256GB 钛色 国家补贴 蔡司2亿APO超级长焦 蓝晶×天玑9400 6000mAh蓝海电池手机
22264517325,新入手的手机不仅外观时尚，而且使用起来非常流畅。更令人惊喜的是它的拍照功能，成像清晰，色彩自然，让每一次拍摄都成为享受。,2025-01-16 10:53:04,0,1,5,2025-01-18 14:07:57,vivo X200 Pro 12GB+256GB 钛色 国家补贴 蔡司2亿APO超级长焦 蓝晶×天玑9400 6000mAh蓝海电池手机
22331087962,这款手机拍照效果非常好，颜色也很清晰。即使在光线昏暗的地方也能拍摄出清晰的画面。续航能力强，充电速度快，是一款性价比非常高的手机，值得入手。,2025-01-23 20:05:08,0,0,5,2025-01-31 04:52:32,vivo X200 Pro 12GB+256GB 钛色 国家补贴 蔡司2亿APO超级长焦 蓝晶×天玑9400 6000mAh蓝海电池手机
22338858538,"外形外观：极窄边框，握持舒适
拍照效果：软硬件都是顶级，拍照效果一流
运行速度：运行流畅，ai功能强大",2025-02-03 20:10:54,0,0,5,2025-02-04 12:57:38,vivo X200 Pro 12GB+256GB 钛色 国家补贴 蔡司2亿APO超级长焦 蓝晶×天玑9400 6000mAh蓝海电池手机
21903148911,物流速度非常快，上午下单，中午就送到了。手机外观非常漂亮，系统使用也非常流畅，顺滑。最惊艳的是手机的拍摄效果非常出色。拍摄远景和近景效果都像专业单反相机一样令人惊艳。拍照完成后，手机自带的AI芯片会对照片进行处理，效果非常逼真，非常出色。,2024-11-29 10:17:17,0,1,5,2024-12-06 14:57:39,vivo X200 Pro 12GB+256GB 钛色 国家补贴 蔡司2亿APO超级长焦 蓝晶×天玑9400 6000mAh蓝海电池手机
21946100912,"拍照效果：像素很好，自带的ai效果也挺有特色
运行速度：屏幕刷新率满足我的需求，目前运行流畅
待机时间：耗电速度挺慢的，一天放着不动基本没掉电",2024-12-12 10:54:57,0,1,5,2024-12-15 09:42:02,vivo X200 Pro 12GB+256GB 钛色 国家补贴 蔡司2亿APO超级长焦 蓝晶×天玑9400 6000mAh蓝海电池手机
21965339746,京东自营配送当日达，新机颜色漂亮，手感很好，感受一下后感这个钛色，爱不释手。处理器性能强劲，充电速度很快，配件齐全，拍照今年旗舰最顶，大底高像素长焦无敌。屏幕色彩显示细腻，还原度很高，质感延续vivo高品质，值得购买。,2024-12-18 01:10:57,0,0,5,2024-12-19 00:29:03,vivo X200 Pro 12GB+256GB 钛色 国家补贴 蔡司2亿APO超级长焦 蓝晶×天玑9400 6000mAh蓝海电池手机
22312215631,"购买vivo是为了拍照功能，之前在实体店试用过，非常喜欢。爱旅行，在旅行时，它的人像模式非常有用。
拍照效果：很赞！
外形外观：很高级，手感好、屏幕大",2025-01-23 08:19:51,0,0,5,2025-01-23 19:26:59,vivo X200 Pro 12GB+256GB 钛色 国家补贴 蔡司2亿APO超级长焦 蓝晶×天玑9400 6000mAh蓝海电池手机
22004807167,vivo X200 Pro真是一款令人惊艳的手机！它拥有卓越的拍照功能，无论是夜景还是日间拍摄，都能捕捉到细腻清晰的画面。性能强劲，运行流畅，玩游戏毫无压力。外观设计时尚大气，握感舒适。续航给力，不用频繁充电。总之，这款手机性价比超高，非常值得入手！,2024-12-24 09:34:25,0,1,5,2024-12-25 16:26:31,vivo X200 Pro 12GB+256GB 钛色 国家补贴 蔡司2亿APO超级长焦 蓝晶×天玑9400 6000mAh蓝海电池手机
22317919657,"用了近十年的某为，今年换了某米和这款VIVO X200 Pro手机，感觉这一款VIVO X200 Pro手机的长焦与远距拍摄效果是真的好。超远距离也能清楚地拍到，不愧是演唱会拍摄神器。
手机背壳的蓝色纹路真的好神奇好漂亮，只是很遗憾，它要被我的手机壳盖住。",2025-01-23 07:01:37,0,1,5,2025-01-25 08:29:33,vivo X200 Pro 12GB+256GB 钛色 国家补贴 蔡司2亿APO超级长焦 蓝晶×天玑9400 6000mAh蓝海电池手机
22183481109,😊拍照和录像都超牛，特别是长焦清楚给力。手机反应很快，跑分性能也很高，系统流畅。我从1加13到魔法7pro到ioqq13都体验了，选定的这个，除了手感偏重，真心好用。,2025-01-05 20:57:29,0,0,5,2025-01-12 15:49:37,vivo X200 Pro 12GB+256GB 钛色 国家补贴 蔡司2亿APO超级长焦 蓝晶×天玑9400 6000mAh蓝海电池手机
22331487714,"首先我要说的是，这款手机的颜值超高，简约的设计风格让我一眼就爱上了它。而且手机的材质也非常讲究，手感一流。

除了外观之外，这款手机的性能也让我非常满意。搭载了最新的处理器，运行速度飞快，无论是玩游戏还是处理文件，都能轻松应对。内存和存储空间也非常充裕，足够我装下所有的应用和数据。

拍照功能更是惊艳！拥有高像素的主摄像头和超广角摄像头，拍出的照片清晰度高，色彩鲜艳。而且夜景模式的表现也非常出色，完全不需要担心光线不足的情况。

最让我惊喜的是这款手机还支持5G网络，这意味着我在户外活动时可以享受到更快的网络速度。而且手机的电池续航能力也非常强大，即使是在高强度的使用情况下，也能坚持很长时间。

总的来说，这款手机真的是一款性价比非常高的产品。如果你正在寻找一款既美观又实用的手机，那么这款手机绝对是你不二的选择！强烈推荐给各位小伙伴们！",2025-01-29 21:41:02,0,0,5,2025-01-31 12:24:51,vivo X200 Pro 12GB+256GB 钛色 国家补贴 蔡司2亿APO超级长焦 蓝晶×天玑9400 6000mAh蓝海电池手机
21994289363,"外形外观：外换好看，特别是白色，太漂亮了
屏幕音效：屏幕效果显示很好，护眼
拍照效果：最值得说的就是拍照，2亿长焦绝了，拍啥啥好看",2024-12-22 22:46:31,0,1,5,2024-12-23 18:22:58,vivo X200 Pro 12GB+256GB 钛色 国家补贴 蔡司2亿APO超级长焦 蓝晶×天玑9400 6000mAh蓝海电池手机
22333000842,"外形外观：手机大小，分量都很满意
屏幕音效：屏幕显示细腻，颜色看着舒服
拍照效果：VIVO 200 PRO，自然就是看中了拍照效果。果然不错，蔡司加上索尼的高端镜头和感光芯片，加上优秀的算法，真的不一样。",2025-01-31 15:24:18,0,0,5,2025-02-01 10:54:29,vivo X200 Pro 12GB+256GB 钛色 国家补贴 蔡司2亿APO超级长焦 蓝晶×天玑9400 6000mAh蓝海电池手机
21973771149,这款手机加购物车很久了，主要是看好它的照相能力，非常棒，客服还非常耐心地解答我的每一个问题。整个购物过程轻松愉快，没有任何压力。此外，产品的质量也非常出色，完全超出了我的期望。我会强烈推荐给我的朋友们，并且自己也会再次光顾。,2024-12-19 15:52:42,0,0,5,2024-12-20 16:31:52,vivo X200 Pro 12GB+256GB 钛色 国家补贴 蔡司2亿APO超级长焦 蓝晶×天玑9400 6000mAh蓝海电池手机
22332290772,"拍照很无敌，X200Pro这个长焦是更强的存在，目前手机里最强的，没有之一。
人像选vivo也几乎是目前公认的了，vivo的人像，给人的感觉就是，哇原来我这么好看。性能、手感都很无敌！处理器也很棒，流畅！",2025-01-30 10:59:46,0,1,5,2025-01-31 21:13:59,vivo X200 Pro 12GB+256GB 钛色 国家补贴 蔡司2亿APO超级长焦 蓝晶×天玑9400 6000mAh蓝海电池手机
21980318469,设计精致白色超那看，手感出色；搭载旗舰芯片，性能强劲；蓝图影像系统卓越，蔡司拍照效果惊艳；Oriain OS5系统流畅稳定。,2024-12-18 00:08:29,0,0,5,2024-12-21 23:42:47,vivo X200 Pro 12GB+256GB 钛色 国家补贴 蔡司2亿APO超级长焦 蓝晶×天玑9400 6000mAh蓝海电池手机
22315118635,新机良心之作，拍照效果非常好，2亿像素超长焦，肉眼，几十米的字体拍的很清晰。画质好，观影体验好，游戏流畅。外观大气，时尚。,2025-01-23 10:33:55,0,1,5,2025-01-24 15:13:57,vivo X200 Pro 12GB+256GB 钛色 国家补贴 蔡司2亿APO超级长焦 蓝晶×天玑9400 6000mAh蓝海电池手机
21928823552,X200pro以其卓越的性能，超清影像和优雅设计赢得了我的青睐。无论是日常使用还是专业需求，他都能轻松应对，带给我极致的体验。屏幕显示效果好，电池续航能力强，拍照效果很好。,2024-12-09 16:33:28,0,1,5,2024-12-11 17:50:30,vivo X200 Pro 12GB+256GB 钛色 国家补贴 蔡司2亿APO超级长焦 蓝晶×天玑9400 6000mAh蓝海电池手机
22326135628,"拍照效果：拍照效果真的绝了👍👍
运行速度：速度嘎嘎快，非常流畅✌️✌️

外形外观：手感超级好，蓝色太好看了！！😘😘",2025-01-25 13:35:18,0,0,5,2025-01-27 17:34:55,vivo X200 Pro 12GB+256GB 钛色 国家补贴 蔡司2亿APO超级长焦 蓝晶×天玑9400 6000mAh蓝海电池手机
22232542848,白月光真的是太美了，关注vivo这款机子很久了，终于入手了，果然没有让我失望，相机功能是它的卖点也真的是一绝。其他方面的性能也是目前市场上机子的翘楚了。这款机子三年内绝对不淘汰。喜欢喜欢，强烈建议白月光。,2025-01-12 19:43:09,0,0,5,2025-01-15 16:05:02,vivo X200 Pro 12GB+256GB 钛色 国家补贴 蔡司2亿APO超级长焦 蓝晶×天玑9400 6000mAh蓝海电池手机
21903522901,钛色的外观真的很有高级感啊，配上大电池和快充以及无线充电，续航特别好，2亿长焦目前手机里最好的长焦，用起来真的很不错,2024-12-04 19:17:36,0,1,5,2024-12-06 16:05:25,vivo X200 Pro 12GB+256GB 钛色 国家补贴 蔡司2亿APO超级长焦 蓝晶×天玑9400 6000mAh蓝海电池手机
