userId,content,boughtTime,voteCount,replyCount,starStep,creationTime,referenceName
21653549250,第一次用vivo，用了这几天下来感觉使用非常流畅，橘子系统确实丝滑。相机是真让我惊艳，电池续航更是超乎意料，不是重度使用的话两天一充都可以。使用体验真的没话说，买首发没失望！推荐给正在犹豫的朋友们！,2024-10-15 02:33:43,20,1,5,2024-10-28 12:35:47,vivo X200 Pro 12GB+256GB 钛色 国家补贴 蔡司2亿APO超级长焦 蓝晶×天玑9400 6000mAh蓝海电池手机
21570549622,首发入了个X200Pro，宝石蓝太好看了，送的赠品也多。内存大，存东西也方便，不担心不够用。长焦YYDS，ai算法加持，10倍也清晰。新的系统用起来很流畅。,2024-10-14 22:26:35,20,7,5,2024-10-16 21:31:01,vivo X200 Pro 12GB+256GB 钛色 国家补贴 蔡司2亿APO超级长焦 蓝晶×天玑9400 6000mAh蓝海电池手机
21647217560,一直有关注这款手机，纠结犹豫后买了宝蓝色，外观惊艳到我了，机身轻薄，蓝色高端大气上档次，配备蔡司超级长焦，画面清晰明亮，电池续航能力也不错，运行也流畅，各种应用几乎秒开，是性价比很高的一款手机。,2024-10-18 19:15:46,26,3,5,2024-10-27 12:05:11,vivo X200 Pro 12GB+256GB 钛色 国家补贴 蔡司2亿APO超级长焦 蓝晶×天玑9400 6000mAh蓝海电池手机
21570789742,颜值非常高！性能与颜值并存，拍照真的很不错，系统很流畅，手握感很好镜头不硌手，就是很容易沾指纹和灰尘，白色真的超级好看！,2024-10-14 21:00:12,16,5,5,2024-10-16 22:12:53,vivo X200 Pro 12GB+256GB 钛色 国家补贴 蔡司2亿APO超级长焦 蓝晶×天玑9400 6000mAh蓝海电池手机
21569763357,vivo X200 Pro，续航持久，两天一充无压力，屏幕护眼，全屏调光绝对好评，超声波指纹解锁快，今年联发科也是超强发挥，性能爆表！,2024-10-14 21:00:16,9,3,5,2024-10-16 19:24:59,vivo X200 Pro 12GB+256GB 钛色 国家补贴 蔡司2亿APO超级长焦 蓝晶×天玑9400 6000mAh蓝海电池手机
21647395123,蓝色的亮面玻璃看起来很漂亮，特别是反光的时候，这个外观设计还是用心了的，有一点沾指纹，不过还好，看起来和镜面一样，很有质感！,2024-10-24 08:20:35,19,3,5,2024-10-27 12:44:11,vivo X200 Pro 12GB+256GB 钛色 国家补贴 蔡司2亿APO超级长焦 蓝晶×天玑9400 6000mAh蓝海电池手机
21563729178,"外形外观：等深四微曲手感握持太舒服了
拍照效果：拍照依旧顶级，人像视频进一步增强
待机时间：续航极客湾排名第一名不虚传",2024-10-14 21:00:16,11,8,5,2024-10-15 19:04:59,vivo X200 Pro 12GB+256GB 钛色 国家补贴 蔡司2亿APO超级长焦 蓝晶×天玑9400 6000mAh蓝海电池手机
21570133787,X200P全新的机身设计手感好了不少，重量也比上一代轻了好多，橘子5系统非常流畅，原子岛功能真的太好用了，还要影像水平又达到了新的巅峰，特别是视频拍摄比肩iPhone了！,2024-10-14 22:20:10,14,6,5,2024-10-16 20:22:16,vivo X200 Pro 12GB+256GB 钛色 国家补贴 蔡司2亿APO超级长焦 蓝晶×天玑9400 6000mAh蓝海电池手机
21651719681,第一次用安卓机，摸索了几天，系统确实很流畅，拍照是我买这个机子主要原因，人像效果很满意。,2024-10-14 21:36:26,12,1,5,2024-10-28 08:59:54,vivo X200 Pro 12GB+256GB 钛色 国家补贴 蔡司2亿APO超级长焦 蓝晶×天玑9400 6000mAh蓝海电池手机
21650175221,冲着拍照功能买的，非常满意，拍人好看，拍动物清晰，色彩鲜艳，手机自带了壳和贴膜，省事。,2024-10-20 22:40:21,14,1,5,2024-10-27 21:45:00,vivo X200 Pro 12GB+256GB 钛色 国家补贴 蔡司2亿APO超级长焦 蓝晶×天玑9400 6000mAh蓝海电池手机
21651823207,手机收到已经使用了一段时间，总体来说产品性能很稳定，电池续航很强，摄像头总体也很好用，长焦镜头和夜景很棒,2024-10-15 12:11:46,7,1,5,2024-10-28 09:25:09,vivo X200 Pro 12GB+256GB 钛色 国家补贴 蔡司2亿APO超级长焦 蓝晶×天玑9400 6000mAh蓝海电池手机
21645428140,"以旧换新：从x90到现在一直用的保值换新服务，感觉确实很好。算一下买个5k的手机用三年再换新机，一年也是1k多，还不如保值换新每年用新机。保值换新还有全保服务，前阵子x100pro摔得稀碎也给免费官方维修，这售后真是顶了
外形外观：这次vivo很听劝，出了直屏，手感和外观都深得我心啊。
拍照效果：不用说，拍照一如既往的好，每次出去玩都会给路人拍照，都会被手机种草。

运行速度：运行极其流畅丝滑，橘子系统yyds
待机时间：x100的蓝海电池中度使用一天一冲都还有余电，这次的电池更大，更久。

家人们不说了，快冲啊",2024-10-25 02:29:51,32,4,5,2024-10-27 00:15:25,vivo X200 Pro 12GB+256GB 钛色 国家补贴 蔡司2亿APO超级长焦 蓝晶×天玑9400 6000mAh蓝海电池手机
21564143546,心心念念的神机终于收到了，地标最强的天玑9400带来的无与伦比的性能加持，超强的摄像头模组，拍照杠杠的，强大的硬件搭配AI ，不管是轻度日常使用还是玩游戏都是游刃有余，对得起我的等待!,2024-10-14 21:00:15,10,6,5,2024-10-15 20:19:16,vivo X200 Pro 12GB+256GB 钛色 国家补贴 蔡司2亿APO超级长焦 蓝晶×天玑9400 6000mAh蓝海电池手机
21565213982,屏幕形态非常好看，电池很耐用，5 个小时才用了 30%，超声波指纹也很快，最惊讶的是，苹果迁移过来，livephoto 无损传过来,2024-10-14 21:00:14,10,5,5,2024-10-16 00:00:57,vivo X200 Pro 12GB+256GB 钛色 国家补贴 蔡司2亿APO超级长焦 蓝晶×天玑9400 6000mAh蓝海电池手机
21647111243,老人家喜欢拍照拍视频，拍照效果很好，非常满意。处理器比之前用的华为强太多了，系统也非常流畅,2024-10-14 21:11:40,6,1,5,2024-10-27 11:42:59,vivo X200 Pro 12GB+256GB 钛色 国家补贴 蔡司2亿APO超级长焦 蓝晶×天玑9400 6000mAh蓝海电池手机
21571252327,第一次用vivo的手机，直接冲了先人一步的手法。体验不错，拍照效果很好,2024-10-14 21:00:29,5,3,5,2024-10-16 23:15:21,vivo X200 Pro 12GB+256GB 钛色 国家补贴 蔡司2亿APO超级长焦 蓝晶×天玑9400 6000mAh蓝海电池手机
21563378582,不得不说这是用的第n台vivo手机了还是让人感到异常的惊喜，我比较注重护眼，这次的护眼升级让眼睛看着很舒服，不会有疲劳感，蓝心小v的大升级也非常实用，原子岛我很喜欢感觉很方便，主要是还有这么多赠品特别好,2024-10-14 21:00:24,8,4,5,2024-10-15 18:06:27,vivo X200 Pro 12GB+256GB 钛色 国家补贴 蔡司2亿APO超级长焦 蓝晶×天玑9400 6000mAh蓝海电池手机
21570347352,质感非常好，1.5K屏非常清晰带电一天还能剩很多倍长焦微距非常厉害非常不错外观设计很有家族式，传承感非常好,2024-10-14 21:00:08,7,3,5,2024-10-16 20:57:09,vivo X200 Pro 12GB+256GB 钛色 国家补贴 蔡司2亿APO超级长焦 蓝晶×天玑9400 6000mAh蓝海电池手机
21652511398,已经使用一周了，从华为换过来，流畅度是让人很惊喜的，续航和拍照都特别棒,2024-10-14 21:21:58,3,1,5,2024-10-28 10:39:51,vivo X200 Pro 12GB+256GB 钛色 国家补贴 蔡司2亿APO超级长焦 蓝晶×天玑9400 6000mAh蓝海电池手机
21569355306,颜值高，拍照清晰，手感很好，赠品也特别多特别实用，真的很喜欢,2024-10-14 22:30:04,2,1,5,2024-10-16 18:16:31,vivo X200 Pro 12GB+256GB 钛色 国家补贴 蔡司2亿APO超级长焦 蓝晶×天玑9400 6000mAh蓝海电池手机
21653144301,"拍照效果：很强。十分出片
屏幕音效：屏幕比x100u护眼，清晰
外形外观：外观漂亮简单大气
以旧换新：补贴不错，买的保值换新真的有百分之八十补贴
待机时间：6000大电池续航能力强得一批
运行速度：天机9400加上橘子系统流畅度无敌
其他特色：期待vivo下一代旗舰做得更好更漂亮！",2024-10-25 19:04:52,47,14,5,2024-10-28 11:49:36,vivo X200 Pro 12GB+256GB 钛色 国家补贴 蔡司2亿APO超级长焦 蓝晶×天玑9400 6000mAh蓝海电池手机
21651766015,因为玩游戏一直买的iQOO，很喜欢vivo的系统，丝滑人性化，这次的旗舰拍照强确实狠狠拿捏住了我，新手机到手续航很不错，玩了两天游戏，基本上每次1-2小时，掉电量都蛮少，拍照超级惊艳，很出片，目前在强光下也还没有遇到炫光现象，就这几天的体验而言，很值,2024-10-25 21:45:04,34,8,5,2024-10-28 09:11:57,vivo X200 Pro 12GB+256GB 钛色 国家补贴 蔡司2亿APO超级长焦 蓝晶×天玑9400 6000mAh蓝海电池手机
21564090073,新系统橘子os5真的太爱了，添加了很多创新的功能，原子岛，小V搜索，用起来实在太方便了，丝滑的操作系统，实在感人，切换不卡顿，不掉帧，屏幕有蔡司色彩，观感更上一级，实在不可挑剔。搭配了x100u的同款蔡司2亿Apo超级长焦，拍照直接拉到顶，还有和索尼合作的新传感器，夜景画面干净喜人，随手拍都好看！！祝vivo再创大卖记录！！！,2024-10-14 22:12:08,34,22,5,2024-10-15 20:10:23,vivo X200 Pro 12GB+256GB 钛色 国家补贴 蔡司2亿APO超级长焦 蓝晶×天玑9400 6000mAh蓝海电池手机
21568407265,"首发当晚购入，买的是&ldquo;先人一步 抢先发货版&rdquo;16+512G, 赠品很不错，TWS A3蓝牙耳机+大疆OSMO MOBLIE SE手持云台+百度****一年+倍思1w毫安充电宝+小度蓝牙音箱灵动版。
开机简单测试了下，系统非常流畅，蓝厂系统一向令人称道。拍照很不错，尤其长焦比手头x80Pro出色强大很多，镜头模组稍大但可以接受。",2024-10-14 22:13:05,18,17,5,2024-10-16 15:54:35,vivo X200 Pro 12GB+256GB 钛色 国家补贴 蔡司2亿APO超级长焦 蓝晶×天玑9400 6000mAh蓝海电池手机
21562302606,发布会结束就马上入手了白月光的Pro版，第二天就到了物流非常的快，到手后把玩了一会就爱不释手，等深四曲的手感超级版，圆润而不硌手，兼顾直屏与曲屏的优点，视觉效果非常好，在天玑9400的强大加持下，性能非常的出色，日常使用三五年不成问题，6000毫安的大电池加上九十瓦的有线充电和三十瓦的无线充电，妥妥用上一天毫无压力，两亿像素的镜头，让原本不爱拍照的我喜欢上了拍照，非常的奈斯，橘子5系统的丝滑流畅，绝对的安卓第一梯队！！！,2024-10-14 21:00:22,14,7,5,2024-10-15 14:47:58,vivo X200 Pro 12GB+256GB 钛色 国家补贴 蔡司2亿APO超级长焦 蓝晶×天玑9400 6000mAh蓝海电池手机
21650532183,"待机时间：6000毫安电池很顶，可玩一天
拍照效果：蔡司影像没话说，绝绝子 
运行速度：很快，快麻溜",2024-10-18 22:58:15,5,3,5,2024-10-27 22:44:59,vivo X200 Pro 12GB+256GB 钛色 国家补贴 蔡司2亿APO超级长焦 蓝晶×天玑9400 6000mAh蓝海电池手机
21568106894,第一次接触这个品牌是iQOO12，这手机玩游戏一流，系统非常流畅和稳定，但是拍照总差点，所以咬咬牙这次换上x200pro，说真的，粉这个品牌粉对了，游戏绝对放心，试了拍照和录像，颠覆了我对安卓机的理解，真的非常好，发两张我随手拍直出样张，是非常随手那种，抛开构图，就这直出效果，画面的层次感，颜色，细节等等都是非常高级的，真的买对手机，非常好用！！,2024-10-14 22:04:55,27,19,5,2024-10-16 14:57:40,vivo X200 Pro 12GB+256GB 钛色 国家补贴 蔡司2亿APO超级长焦 蓝晶×天玑9400 6000mAh蓝海电池手机
21651723711,vivox200pro采用了全等深微四曲面设计，这是我换掉x100s换新x200pro的主要原因。不仅视觉效果很舒服，手感也特别棒，让人爱不释手。搭天玑9400旗舰芯片。无论是日常使用还是高负载游戏，都能轻松应对，带来流畅稳定的体验。它的影像系统更加让人觉得无敌，2亿的长焦体验让人觉得它的影像能力真的很强大。视频拍摄里的log专业模式，让人拿手机也可以去尝试拍摄出电影质感的视频。而且OriginOS 5系统，带来原子岛、很方便,2024-10-14 21:52:15,6,11,5,2024-10-28 09:01:14,vivo X200 Pro 12GB+256GB 钛色 国家补贴 蔡司2亿APO超级长焦 蓝晶×天玑9400 6000mAh蓝海电池手机
21569810458,先人一步的感觉真棒，配送速度快赠品多，这个手机一上手的手感真的非常好，前所未有的好，是我这些年来用过手感最好的手机，四微曲屏真的大大的加分，影像一如既往的强，续航也比以为旗舰机更加持久，屏幕素质也升级了观感很好很舒适，总结这款手机是一款非常全能的水桶旗舰机。,2024-10-14 22:14:17,6,7,5,2024-10-16 19:33:27,vivo X200 Pro 12GB+256GB 钛色 国家补贴 蔡司2亿APO超级长焦 蓝晶×天玑9400 6000mAh蓝海电池手机
21561796320,京东先人一步计划，提前拿到，体验感相当不错！小米转过来的，橘子系统很不错！,2024-10-14 21:00:10,2,7,5,2024-10-15 12:52:58,vivo X200 Pro 12GB+256GB 钛色 国家补贴 蔡司2亿APO超级长焦 蓝晶×天玑9400 6000mAh蓝海电池手机
21647350275,X200pro的表现令人满意，尤其喜欢它的摄影能力。手感舒适，运行流畅，游戏和日常使用都很不错。希望后续能继续保持这样的品质。,2024-10-15 00:36:25,1,1,5,2024-10-27 12:33:54,vivo X200 Pro 12GB+256GB 钛色 国家补贴 蔡司2亿APO超级长焦 蓝晶×天玑9400 6000mAh蓝海电池手机
21565147175,首发就直接冲了，非常看中vivo的影像能力，昨天晚上下单今天早上就到了，非常速度。关注了这款手机挺久了，感觉拿到手还是很不错的，送的赠品也是比较实用，期待后续的使用情况。,2024-10-14 22:04:25,4,5,5,2024-10-15 23:35:06,vivo X200 Pro 12GB+256GB 钛色 国家补贴 蔡司2亿APO超级长焦 蓝晶×天玑9400 6000mAh蓝海电池手机
21566783619,"收到了抢到先人一步就是好还有送云台和耳机，刚好拿年初买的iqooneo9pro做了以旧换新，磕磕碰碰的旧手机还能合起来抵扣2000，很满意。回收人员上门回收服务很好，拍照效果我很满意。换vivo X200pro本来还怕太重什么的，但是我感觉也还好，很舒服没有头重脚轻的问题
以旧换新：iqooneo9pro",2024-10-14 22:09:48,3,5,5,2024-10-16 11:29:11,vivo X200 Pro 12GB+256GB 钛色 国家补贴 蔡司2亿APO超级长焦 蓝晶×天玑9400 6000mAh蓝海电池手机
21567152250,终于也是抢到了一次vivo的快人一步，今天早上收到了x200pro，机身非常轻薄，颜值非常高。天机9400运行非常流畅，我非常满意！物流也很快，第二天就送到了，礼品也很多。手机拍照特别清晰，随手一拍就是大片，值得入手推荐！,2024-10-14 22:16:27,3,3,5,2024-10-16 12:31:09,vivo X200 Pro 12GB+256GB 钛色 国家补贴 蔡司2亿APO超级长焦 蓝晶×天玑9400 6000mAh蓝海电池手机
21653555312,手机非常好，拍照非常清晰，运行也非常流畅，vivo老粉了，用了三台手机了，体验感非常好,2024-10-26 18:41:17,1,1,5,2024-10-28 12:37:33,vivo X200 Pro 12GB+256GB 钛色 国家补贴 蔡司2亿APO超级长焦 蓝晶×天玑9400 6000mAh蓝海电池手机
21570031364,vivoX200Pro，影像实力惊艳，性能卓越，值得拥有！做移动影像的超越者,2024-10-14 22:04:23,6,3,5,2024-10-16 20:07:16,vivo X200 Pro 12GB+256GB 钛色 国家补贴 蔡司2亿APO超级长焦 蓝晶×天玑9400 6000mAh蓝海电池手机
21647582764,收到商品后，我感到非常满意！质量超出预期，服务也非常棒。卖家真是很用心，强烈推荐给大家，真心值得购买！,2024-10-15 17:08:59,0,1,5,2024-10-27 13:25:21,vivo X200 Pro 12GB+256GB 钛色 国家补贴 蔡司2亿APO超级长焦 蓝晶×天玑9400 6000mAh蓝海电池手机
21650918385,"1、拍照没话说，不管是照片还是视频，估计在现有手机里肯定是数一数二的存在，媲美单反的画质，完全超越单反使用的便利，如果热爱摄影，无视其他的，可以无脑入。而且可以把玩的拍照功能很多，非常适合摄影爱好者。
2、系统很简洁也很流畅，相比我原来的三星系统来说真是简洁了许多。
3、电池没有花时间去测，但是感觉很耐用。
4、手机质感很漂亮，我这台没有任何问题，也没有炫光。",2024-10-15 08:33:50,1,1,5,2024-10-28 00:11:11,vivo X200 Pro 12GB+256GB 钛色 国家补贴 蔡司2亿APO超级长焦 蓝晶×天玑9400 6000mAh蓝海电池手机
21650888412,"外形外观：钛色背板ag磨砂玻璃有质感不留指纹，拉丝边框。质感嘎嘎高
屏幕音效：屏幕素质实话不错。显示效果很好。护眼挺好不眼干眼涩眼疲劳
运行速度：系统丝滑优化的不错，没有任何卡顿。
拍照效果：拍人美，长焦是真牛。夜景无敌了。炫光问题没有碰到。
待机时间：6000毫安轻度使用两天一充。正常使用一天一充。很强告别电量焦虑。
整体来说可能是这几年最全面的PRO",2024-10-16 15:42:10,1,1,5,2024-10-27 23:57:25,vivo X200 Pro 12GB+256GB 钛色 国家补贴 蔡司2亿APO超级长焦 蓝晶×天玑9400 6000mAh蓝海电池手机
21651751525,这次购物体验让我非常满意。从商品的质量到客服的服务态度，每一环节都做得尽善尽美。商品的质量非常出色，超出了我的预期，使用起来感觉非常舒适和方便。客服人员的态度也非常友好和专业，对于我的每一个疑问都给予了耐心而详细的解答。整个购物流程顺畅无阻，让我感到十分愉悦。我对这次购物体验感到非常满意，强烈推荐给大家。,2024-10-19 17:00:30,0,1,5,2024-10-28 09:07:56,vivo X200 Pro 12GB+256GB 钛色 国家补贴 蔡司2亿APO超级长焦 蓝晶×天玑9400 6000mAh蓝海电池手机
21564834958,"vivo X200 Pro 宝石蓝，一款集颜值与性能于一身的旗舰手机。外观上，宝石蓝配色璀璨夺目，流线型设计手感舒适，让人一见倾心。性能上，搭载天玑9400处理器，无论是日常应用还是大型游戏，都能轻松应对，流畅不卡顿。
影像系统是它的另一大亮点，蔡司2亿APO超级长焦镜头，配合蓝图影像芯片V3+，无论白天黑夜，都能捕捉细腻、清晰的画面，让摄影爱好者爱不释手。同时，6000mAh大容量电池搭配90W快充技术，解决你的电量焦虑，让你随时随地享受无忧续航。
屏幕方面，6.78英寸全等深微四曲屏，色彩鲜艳，观感舒适，无论是追剧还是游戏，都能带来沉浸式的视觉体验。此外，vivo X200 Pro 还创新性地引入了公里级无网通信技术，在紧急情况下也能保持与外界的联系，为你的安全保驾护航。
总的来说，我觉得 vivo X200 Pro 宝石蓝不仅是一款外观出众的手机，更是一款在性能、影像、续航、屏幕以及创新技术等方面都表现出色的旗舰产品，值得每一位追求品质生活的你拥有。",2024-10-14 22:32:41,13,10,5,2024-10-15 22:22:45,vivo X200 Pro 12GB+256GB 钛色 国家补贴 蔡司2亿APO超级长焦 蓝晶×天玑9400 6000mAh蓝海电池手机
21651429189,不愧是vivo新品，价格适中，配置拉满，特别是大电池，用一天能没用完，拍出来的照片也不错，随手一拍就是大片，解除了我这个手残党，总之一句话这个手机买的不亏，不错不错值得推荐！,2024-10-26 16:09:51,1,2,5,2024-10-28 07:07:25,vivo X200 Pro 12GB+256GB 钛色 国家补贴 蔡司2亿APO超级长焦 蓝晶×天玑9400 6000mAh蓝海电池手机
21652677252,很流畅，屏幕色彩不错，拍照方面，图3是我的iPhone13pm，图4是这个vivo，虽然不同时期的机子没啥可比性，但是感觉vivo还是好很多的。支持国产！期待国产机越来越好！,2024-10-20 00:04:23,2,2,5,2024-10-28 10:58:43,vivo X200 Pro 12GB+256GB 钛色 国家补贴 蔡司2亿APO超级长焦 蓝晶×天玑9400 6000mAh蓝海电池手机
21649018162,vivo X200 Pro给我留下了深刻的印象。它的外观设计优雅，手感舒适。性能方面，搭载的天玑9400旗舰芯片表现出色，运行流畅。影像系统尤其强大，无论是主摄还是长焦，都能拍出高质量的照片，作为主打拍照手机，虽说存在炫光问题，但官方承诺将在不久给出解决方案，期待能兑现承诺。OriginOS 5系统也带来了很多实用的功能。总的来说，vivo X200 Pro是一款值得推荐的手机。,2024-10-15 19:48:49,2,3,5,2024-10-27 18:23:46,vivo X200 Pro 12GB+256GB 钛色 国家补贴 蔡司2亿APO超级长焦 蓝晶×天玑9400 6000mAh蓝海电池手机
21570939325,机子拿到手啦，整体体验还是非常棒的，x7ultra换过来的，最明显的体验提升就是续航很强、超声波指纹很好用！然后就是这颗中长焦镜头是真的强，适用性是强于x7ultra的双长焦的，但是希望后期可以改进一下成像体验，不要过多的锐化和涂抹，色彩风格上加强一下光影呈现吧，希望vivo官方能看到我的这点小建议，谢谢啦！,2024-10-14 22:28:10,4,3,5,2024-10-16 22:28:16,vivo X200 Pro 12GB+256GB 钛色 国家补贴 蔡司2亿APO超级长焦 蓝晶×天玑9400 6000mAh蓝海电池手机
21651748929,从iPhone 15升级到200 Pro，我不得不说，为了演唱会拍摄效果，这是一个值得的飞跃。新手机的相机功能令人惊叹，无论是照片还是视频，都能捕捉到细腻的细节和丰富的色彩。即使在光线不足的环境下，也能拍出清晰明亮的画面。,2024-10-26 14:59:57,1,2,5,2024-10-28 09:06:55,vivo X200 Pro 12GB+256GB 钛色 国家补贴 蔡司2亿APO超级长焦 蓝晶×天玑9400 6000mAh蓝海电池手机
21566676732,拍照对比X100pro有质的飞跃，手感变更好了，屏幕误触的机率基本不存在了。值得升级,2024-10-14 21:00:16,2,1,5,2024-10-16 11:11:47,vivo X200 Pro 12GB+256GB 钛色 国家补贴 蔡司2亿APO超级长焦 蓝晶×天玑9400 6000mAh蓝海电池手机
21650390635,拍照非常好，电池续航也很好，一天仅需一次充电，炫光问题等待官方方案吧，拍照影响不大，视频可能有一些影响,2024-10-20 23:54:11,4,3,5,2024-10-27 22:24:20,vivo X200 Pro 12GB+256GB 钛色 国家补贴 蔡司2亿APO超级长焦 蓝晶×天玑9400 6000mAh蓝海电池手机
21651636107,续航不错，系统流畅，外观比上一代也好看了，还有赠品，综合感觉这一代值得购买！,2024-10-20 22:30:33,2,2,5,2024-10-28 08:38:05,vivo X200 Pro 12GB+256GB 钛色 国家补贴 蔡司2亿APO超级长焦 蓝晶×天玑9400 6000mAh蓝海电池手机
21566663682,影像方面确实可以相信蓝厂，X200 Pro的影像做到了接近超大杯的体验，这一点还是值得点赞的,2024-10-14 22:19:05,6,5,5,2024-10-16 11:09:28,vivo X200 Pro 12GB+256GB 钛色 国家补贴 蔡司2亿APO超级长焦 蓝晶×天玑9400 6000mAh蓝海电池手机
21650714313,趁着天气好用新手机出去拍了点照片，x200pro的效果确实不错！,2024-10-18 08:57:32,0,1,5,2024-10-27 23:21:22,vivo X200 Pro 12GB+256GB 钛色 国家补贴 蔡司2亿APO超级长焦 蓝晶×天玑9400 6000mAh蓝海电池手机
21651811671,蓝色的确很棒，暗光拍摄能力一绝，尤其是 Local HDR功能，效果尤为显著。很看好这一轮的长焦升级，希望VIVO能够在未来的手机中持续突破。,2024-10-17 09:08:25,0,1,5,2024-10-28 09:21:49,vivo X200 Pro 12GB+256GB 钛色 国家补贴 蔡司2亿APO超级长焦 蓝晶×天玑9400 6000mAh蓝海电池手机
21566614385,vivo X200 Pro是一款集影像、性能与设计于一身的旗舰手机。其全等深微四曲面设计带来出色手感，天玑9400旗舰芯片确保流畅体验。搭载蔡司2亿像素超级长焦镜头，拍照效果令人惊艳。OriginOS 5系统智慧便捷，整体表现均衡，是追求高品质生活的用户的不二之选。,2024-10-14 21:00:35,2,1,5,2024-10-16 11:02:02,vivo X200 Pro 12GB+256GB 钛色 国家补贴 蔡司2亿APO超级长焦 蓝晶×天玑9400 6000mAh蓝海电池手机
21653063580,从开始的vivoX100Pro，到今天的X200Pro，依旧没有让人失望，系统流程，长焦能力强，很满意的手机,2024-10-14 22:33:07,0,1,5,2024-10-28 11:38:43,vivo X200 Pro 12GB+256GB 钛色 国家补贴 蔡司2亿APO超级长焦 蓝晶×天玑9400 6000mAh蓝海电池手机
21652453424,用VIVO三年了，每年出新款都来支持✊。这次x200pro送给妻子，她也是爱不释手。这两年的VIVO无论是X系列还是子品牌IQOO12都是有明显的进步，整体性能及拍照成像。有目共睹得到了市场的认可。一人升级全家升级，家里长辈手机也都换成了X90 X100了，值得推荐的品牌，暴赞,2024-10-15 14:04:25,0,1,5,2024-10-28 10:33:28,vivo X200 Pro 12GB+256GB 钛色 国家补贴 蔡司2亿APO超级长焦 蓝晶×天玑9400 6000mAh蓝海电池手机
21572678889,vivox200pro国产手机天花板了。拍照无论长焦、微距，随手一拍氛围感直逼微单。蔡司显色大师超清超通透，天玑9400，全程120帧满帧游戏画面，现在市面最好游戏体验。一直用着苹果，第一次用安卓手机，惊艳、惊喜，各种全面超越的体验。only vivo can do！！！强烈推荐x200pro，现在你能买到最好的手机！,2024-10-14 21:00:08,4,2,5,2024-10-17 09:13:23,vivo X200 Pro 12GB+256GB 钛色 国家补贴 蔡司2亿APO超级长焦 蓝晶×天玑9400 6000mAh蓝海电池手机
