userId,content,boughtTime,voteCount,replyCount,starStep,creationTime,referenceName
22317454033,"外形外观：外观时尚，蓝色很漂亮高级
屏幕音效：屏幕显示效果对比上一代升级很大，显示清晰，色彩鲜艳，护眼拉满
拍照效果：拍照一绝，vivo 的拿手好戏，各种模式都很好用，尤其喜欢自然色彩
运行速度：流畅流畅流畅，T0 级别
以旧换新：现在买有国补很优惠",2025-01-22 20:03:05,0,1,5,2025-01-24 23:54:19,vivo X200 Pro 12GB+256GB 钛色 国家补贴 蔡司2亿APO超级长焦 蓝晶×天玑9400 6000mAh蓝海电池手机
21981433559,这款vivo手机非常好用，充电速度快，性能稳定，系统非常流畅，今年新出的几款手机里面天花板，拍照效果清晰。蓝色背面很靓，正面屏幕边框黑边很窄，观感不错，整体非常满意。注重拍照，唯一选择,2024-12-20 09:42:56,0,1,5,2024-12-22 10:36:04,vivo X200 Pro 12GB+256GB 钛色 国家补贴 蔡司2亿APO超级长焦 蓝晶×天玑9400 6000mAh蓝海电池手机
21661008771,整體不錯，如果拍照沒有眩光就滿分了,2024-10-14 21:17:43,1,1,3,2024-10-29 15:36:13,vivo X200 Pro 12GB+256GB 钛色 国家补贴 蔡司2亿APO超级长焦 蓝晶×天玑9400 6000mAh蓝海电池手机
22268119050,好好好好好好好好好好，嘎嘎盖，太牛了！帅帅帅帅！期待已久！用了好多苹果手机了，看了好多拍照手机，这款手机排名最靠前。到手试了，确实很不错，清晰，有质感。推荐购买！,2025-01-16 13:44:51,0,1,5,2025-01-19 12:17:47,vivo X200 Pro 12GB+256GB 钛色 国家补贴 蔡司2亿APO超级长焦 蓝晶×天玑9400 6000mAh蓝海电池手机
22331387332,手机颜色好看、大气、手感好、使用起来速度快，大电池不用天天充电，照相效果好、带广角会根据不同环境补光，处理器很好，运行速度很快、不卡顿，性价比高！,2025-01-26 12:39:28,0,0,5,2025-01-31 11:18:00,vivo X200 Pro 12GB+256GB 钛色 国家补贴 蔡司2亿APO超级长焦 蓝晶×天玑9400 6000mAh蓝海电池手机
21987428029,发货很快，买之前去线下体验店看了一圈，最后还是选择了X200Pro，无论是拍照还是流畅度都没得说，刷了半小时视频电池掉了百分之四，续航很有安全感，听歌试了外放也很清晰，还有很多功能还没来得及试玩，包括AI圈图识别，游戏流畅和散热，其他的还有一个就是低温续航，这个在东北真的很实用，作为旗舰机型各方面真的很满意，期待vivo越做越好，功能随着系统更新也更加完善,2024-12-22 17:20:59,0,1,5,2024-12-23 00:27:13,vivo X200 Pro 12GB+256GB 钛色 国家补贴 蔡司2亿APO超级长焦 蓝晶×天玑9400 6000mAh蓝海电池手机
21978844403,"屏幕音效：显示可以，比上一代双曲屏好，音效没有特别突出
拍照效果：t0水平，秒杀其他手机，特别是长焦微距，确实牛
外形外观：换成四曲面屏确实手感好
运行速度：天玑9400流畅不卡，不发热
待机时间：特别长，比去年的机器都好，价格到位值得购买",2024-12-12 10:38:55,0,0,5,2024-12-21 17:11:35,vivo X200 Pro 12GB+256GB 钛色 国家补贴 蔡司2亿APO超级长焦 蓝晶×天玑9400 6000mAh蓝海电池手机
21912624541,"拍照效果：很好👍👍👍👍👍照片很清晰
运行速度：快速💨速度如闪电❤️
以旧换新：性价比超高
外形外观：潮流时尚
屏幕音效：👌🏿
待机时间：好
其他特色：玩游戏
很顺畅！Good！！",2024-11-28 22:13:41,0,1,5,2024-12-08 18:38:58,vivo X200 Pro 12GB+256GB 钛色 国家补贴 蔡司2亿APO超级长焦 蓝晶×天玑9400 6000mAh蓝海电池手机
21966976401,"感觉屏幕和小米手机的差不多，屏幕看上去很亮，后面镜头很大，速度也挺快，首发价格还可以吧，第一次买vivo手机，感觉挺好的！
拍照效果：很棒👍🏻
外形外观：很好",2024-12-18 08:58:12,0,0,5,2024-12-19 12:24:56,vivo X200 Pro 12GB+256GB 钛色 国家补贴 蔡司2亿APO超级长焦 蓝晶×天玑9400 6000mAh蓝海电池手机
21912581800,"多年苹果用户，转战安卓，首选vivo x200影像灭霸，国产这么强了么，影音机皇莫属；
王者荣耀还有专属游戏加持，谁说外放差了，一点也不差，售后服务特别好，每年还有免费贴膜，还有专属主题定制，还可以小V小V找手机，太方便啦😊",2024-12-07 21:10:50,0,1,5,2024-12-08 18:28:02,vivo X200 Pro 12GB+256GB 钛色 国家补贴 蔡司2亿APO超级长焦 蓝晶×天玑9400 6000mAh蓝海电池手机
22335157688,"外形外观：非常不错，那个大摄像头
屏幕音效：耳机非常的降噪，效果非常好
拍照效果：非常专业，很适合演唱会拍照
运行速度：非常快
其他特色：手感非常的好。",2025-01-30 23:00:37,0,0,5,2025-02-02 14:52:06,vivo X200 Pro 12GB+256GB 钛色 国家补贴 蔡司2亿APO超级长焦 蓝晶×天玑9400 6000mAh蓝海电池手机
22334236898,"终于入手了vivo X200 Pro，用了几天真的忍不住来夸一夸！首先外观设计太惊艳了，我选的这款配色高级感十足，手感细腻，拿在手里特别有质感。屏幕显示效果非常清晰，色彩鲜艳，看视频、打游戏都是一种享受。  
最让我惊喜的是它的拍照能力！蔡司镜头果然名不虚传，无论是白天还是夜晚，拍出来的照片都特别清晰，色彩还原度很高，尤其是人像模式，背景虚化自然，皮肤细节处理得也很到位，完全不用修图直接发朋友圈！  
性能方面也很强悍，搭载的最新处理器运行流畅，玩大型游戏完全不卡顿，散热效果也很好。电池续航也很给力，一天下来电量还有剩余，快充功能更是让我告别了电量焦虑。  
总之，vivo X200 Pro绝对是一款值得入手的旗舰机，无论是颜值、拍照还是性能，都让我非常满意！强烈推荐给大家！",2025-01-30 08:08:12,0,0,5,2025-02-01 23:23:39,vivo X200 Pro 12GB+256GB 钛色 国家补贴 蔡司2亿APO超级长焦 蓝晶×天玑9400 6000mAh蓝海电池手机
22195472884,"外观：包装完好，手机拿在手里非常有质感
电池：电池非常耐用，收到货后显示36的虚电但让我倒腾资料用了3个小时
体验：整体运行非常流畅，没有卡顿延迟等情况
物流：发货速度很快，次日送达。
售后：没有遇到问题，所以不存在售后，希望以后也不要用到。",2025-01-11 10:46:46,0,1,5,2025-01-13 11:11:51,vivo X200 Pro 12GB+256GB 钛色 国家补贴 蔡司2亿APO超级长焦 蓝晶×天玑9400 6000mAh蓝海电池手机
21993695574,"最近入手了 vivo X200 Pro，真的让我超级满意！
        外观时尚大气，[具体颜色]的机身质感十足，拿在手里尽显优雅，而且轻薄的设计长时间握持也不累手。
        屏幕显示效果惊艳，色彩鲜艳、清晰细腻，无论是看视频还是玩游戏，视觉体验都拉满。
       拍照性能更是强大，后置摄像头的配置在各种场景下都表现出色。主摄拍摄的照片细节丰富，色彩还原度高；超广角镜头让我轻松拍下广阔的风景；长焦镜头也能满足我拍摄远处景物的需求，变焦后的画质依然清晰。夜拍模式更是一绝，暗处的细节和色彩都能精准捕捉，噪点控制得很好，每一张夜景照片都能媲美专业相机的效果。
        性能方面，运行流畅，日常使用各种应用快速开启，多任务处理也不在话下，玩大型游戏时帧率稳定，没有出现卡顿现象，散热做得也不错，不会因为发热而影响使用体验。
       电池续航能力让我很安心，一整天的中度使用下来，电量还有剩余，快充功能更是让它能在短时间内迅速回血，解决电量焦虑。
        vivo X200 Pro 各方面都实力强劲，完全满足了我对智能手机的需求，真的是一款非常值得推荐的手机！",2024-12-19 19:04:03,0,1,5,2024-12-23 16:35:25,vivo X200 Pro 12GB+256GB 钛色 国家补贴 蔡司2亿APO超级长焦 蓝晶×天玑9400 6000mAh蓝海电池手机
22330531230,屏幕窄边框，边缘轻微弧度，视觉效果很赞，拍照画质令人满意，摄像头模组较厚，在可接受范围内，系统功能齐全，易用性不错，ai挺好玩的，初步感受电池续航很强，国补下性价比很高。,2025-01-29 10:45:27,0,0,5,2025-01-30 17:27:09,vivo X200 Pro 12GB+256GB 钛色 国家补贴 蔡司2亿APO超级长焦 蓝晶×天玑9400 6000mAh蓝海电池手机
21947295762,"外形外观：很顺手有质感。
拍照效果：很清晰，能拍很远。
待机时间：一直看小说，危险打字聊天能坚持一天半，看小说可能两天消耗完。
运行速度：很快，没有卡过。",2024-10-31 01:29:28,0,1,5,2024-12-15 14:42:48,vivo X200 Pro 12GB+256GB 钛色 国家补贴 蔡司2亿APO超级长焦 蓝晶×天玑9400 6000mAh蓝海电池手机
22328845672,京东快递 非常好 初一就给送到  VIVO X200PRo做工精细 手感很好 系统运行流畅丝滑 拍照也很好 充电速度很快  送的保护壳手感很好 不需要在另买 非常喜欢VIVO 希望越来越好,2025-01-27 21:14:44,0,0,5,2025-01-29 11:19:52,vivo X200 Pro 12GB+256GB 钛色 国家补贴 蔡司2亿APO超级长焦 蓝晶×天玑9400 6000mAh蓝海电池手机
22071301892,宝石蓝这个颜色很好看，太喜欢。用起来手感很好，刷视频很流畅，拍照一流，很清晰太喜欢了！刚入手游戏还没玩过，但我相信体验感肯定好！,2025-01-02 21:53:18,0,1,5,2025-01-04 20:53:12,vivo X200 Pro 12GB+256GB 钛色 国家补贴 蔡司2亿APO超级长焦 蓝晶×天玑9400 6000mAh蓝海电池手机
21965050406,第一次使用四等深微曲屏，真的很惊艳，屏幕色彩也比之前的手机鲜艳，超声波指纹识别很快也很准，2亿像素的长焦真的很强，隔很远也能拍到，真的很棒。,2024-12-17 22:06:16,0,0,5,2024-12-18 23:01:07,vivo X200 Pro 12GB+256GB 钛色 国家补贴 蔡司2亿APO超级长焦 蓝晶×天玑9400 6000mAh蓝海电池手机
22339748027,"vivo X200 Pro的外观设计非常惊艳，机身轻薄，手感舒适，尤其是背面的磨砂质感，既高级又防指纹。我选的这款颜色（如：星夜黑/晨曦白）非常耐看，搭配金属边框。
这款手机的拍照功能真的让我惊艳，无论是白天还是夜晚，拍出来的照片都非常清晰，色彩还原也很真实。尤其是夜景模式，暗光环境下也能拍出细节丰富的照片。自拍效果也很自然，美颜功能不会过度修饰。运行速度非常快，无论是日常使用还是玩大型游戏，都非常流畅。12GB的运行内存让多任务切换毫无压力，256GB的存储空间也完全够用。
OriginOS系统用起来很顺手，界面简洁，功能丰富，还有很多实用的小功能，比如分屏、手势操作等，提升了使用效率。
双扬声器音质不错，外放效果很好。另外，NFC、红外遥控等功能也很实用，日常生活中的各种场景都能轻松应对。
vivo X200 Pro是一款非常全面的旗舰手机，无论是外观、性能还是拍照，都达到了很高的水准。如果你在寻找一款性价比高、体验出色的手机，这款绝对值得购买。",2025-02-02 09:53:05,0,0,5,2025-02-04 19:11:43,vivo X200 Pro 12GB+256GB 钛色 国家补贴 蔡司2亿APO超级长焦 蓝晶×天玑9400 6000mAh蓝海电池手机
21964924168,"外形外观：很有质感，很高大上。
屏幕音效：屏幕色彩好，音效不错。
拍照效果：顶级拍照效果，效果非常好。
运行速度：运行速度超快，超级流畅。
待机时间：电池容量大，待机时间超长。",2024-12-11 23:59:58,0,0,5,2024-12-18 22:27:33,vivo X200 Pro 12GB+256GB 钛色 国家补贴 蔡司2亿APO超级长焦 蓝晶×天玑9400 6000mAh蓝海电池手机
22314741059,看重vivo x200 Pro的拍照功能，赶在春节出游前下单，感谢客服协助催发货和物流，终于在节前收到。浅试了拍照，很不错，比我的fold6好太多，今年演唱会拍视频就靠它了。,2025-01-22 16:46:35,0,1,5,2025-01-24 13:34:23,vivo X200 Pro 12GB+256GB 钛色 国家补贴 蔡司2亿APO超级长焦 蓝晶×天玑9400 6000mAh蓝海电池手机
22336742151,"外形外观：很漂亮，高级感满满
屏幕音效：屏幕清晰明亮
拍照效果：拍照特别强
运行速度：运行速度很快
待机时间：超长待机，电池抗用
整体很满意",2025-01-20 22:12:47,0,0,5,2025-02-03 12:12:06,vivo X200 Pro 12GB+256GB 钛色 国家补贴 蔡司2亿APO超级长焦 蓝晶×天玑9400 6000mAh蓝海电池手机
22321908624,"外形外观：外形很好看，趁手
拍照效果：拍照杠杠的
运行速度：很流畅
其他特色：电池很耐用，一整天就只用充一次电",2025-01-22 21:17:36,0,0,5,2025-01-26 13:00:57,vivo X200 Pro 12GB+256GB 钛色 国家补贴 蔡司2亿APO超级长焦 蓝晶×天玑9400 6000mAh蓝海电池手机
21948958759,机器是新款，看介绍还是不错的，超长待机、像素高、颜值高、容量大。一口气在京东下了两单。直播间购买还能有音箱赠送。评论回复还有80w快充，诚意满满。,2024-12-12 18:47:41,0,1,5,2024-12-15 20:57:33,vivo X200 Pro 12GB+256GB 钛色 国家补贴 蔡司2亿APO超级长焦 蓝晶×天玑9400 6000mAh蓝海电池手机
22273890652,第一次用VIVO，买之前是有点忐忑的，使用之后确实有点意料之外，满是惊喜。首先手机颜值很高，质感也一级棒；系统性能什么的不多赘述，重点说说拍照，影响系统名副其实，拍的每一张、每一帧都是大片级，尤其夜景效果绝佳，绝对值得点个赞。,2025-01-13 22:53:06,0,1,5,2025-01-20 16:21:32,vivo X200 Pro 12GB+256GB 钛色 国家补贴 蔡司2亿APO超级长焦 蓝晶×天玑9400 6000mAh蓝海电池手机
22170614721,"外形外观：惊艳无比
拍照效果：杠杠的，超级清晰
运行速度：丝滑流畅
待机时间：正常使用超级耐用
屏幕音效：屏幕也是个顶个的好",2025-01-10 21:00:37,0,0,5,2025-01-11 21:39:54,vivo X200 Pro 12GB+256GB 钛色 国家补贴 蔡司2亿APO超级长焦 蓝晶×天玑9400 6000mAh蓝海电池手机
22321400625,"拍照效果：拍照效果不用质疑，放大三十倍细节也还是能拍的很清楚，人像模式拍照和相机很像，效果很好，本来就是冲着vivo这个摄像头来的。

其他特色：本来用的是苹果，还怕用不习惯，但是完全没有，系统也非常流畅，vivo系统的功能感觉更全面，还有很多没有探索出来怎么用。充电真的是超级快，不要一个小时就能充满，而且电池也很耐用，出去玩一天了才用了一半多的点。",2025-01-21 21:36:08,0,0,5,2025-01-26 10:27:58,vivo X200 Pro 12GB+256GB 钛色 国家补贴 蔡司2亿APO超级长焦 蓝晶×天玑9400 6000mAh蓝海电池手机
22077652109,终于下手了 这款型号的拍照很合适 很满意 特别清晰 然后手机外观设计漂亮 喜欢 最重要的是打游戏特别丝滑哈哈,2024-12-24 14:35:04,0,1,5,2025-01-05 12:42:59,vivo X200 Pro 12GB+256GB 钛色 国家补贴 蔡司2亿APO超级长焦 蓝晶×天玑9400 6000mAh蓝海电池手机
22045424091,收到手机手机用了10多天了，真心好用，续航很好，系统流畅度非常高，拍照不用说了vivo的强项，尤其是长焦用起来真心舒服,2024-12-12 00:59:28,0,1,5,2025-01-02 11:44:44,vivo X200 Pro 12GB+256GB 钛色 国家补贴 蔡司2亿APO超级长焦 蓝晶×天玑9400 6000mAh蓝海电池手机
21974125243,一般手机不咋滴，网还不太好,2024-12-18 21:21:59,6,2,1,2024-12-20 17:34:34,vivo X200 Pro 12GB+256GB 钛色 国家补贴 蔡司2亿APO超级长焦 蓝晶×天玑9400 6000mAh蓝海电池手机
22181068485,"送达效果非常好，下单的一个半小时就直接送到了。手机质量也很好，钛金色比我想象中的要更好看一些。
手机质量稍微有些轻，大大的摄像头背面看也好看，屏幕效果很棒，拍照很强力！10倍拍人脸也很舒服。这会儿正在上一个x90导数据，手机导数据也很方便。整体都很喜欢。",2025-01-12 10:16:22,0,1,5,2025-01-12 12:54:03,vivo X200 Pro 12GB+256GB 钛色 国家补贴 蔡司2亿APO超级长焦 蓝晶×天玑9400 6000mAh蓝海电池手机
22262174022,"帮朋友买的
外形外观：这背面看起来太漂亮了
屏幕音效：声音效果很好，声音非常的大，有低音效果
拍照效果：拍照非常的信息，杠杠的，100倍像素
待机时间：手机续航能力超强一天重度使用也能用十个小时以上",2025-01-14 01:15:15,0,1,5,2025-01-17 21:21:11,vivo X200 Pro 12GB+256GB 钛色 国家补贴 蔡司2亿APO超级长焦 蓝晶×天玑9400 6000mAh蓝海电池手机
22088641275,外形好看，屏幕大清晰不累眼，运行流畅丝滑，拍照确实不错，摄影模组实在是太显眼了，用久了折叠屏，发现直屏手机省电很多，续航焦虑没了,2025-01-02 15:54:34,0,0,5,2025-01-06 12:47:49,vivo X200 Pro 12GB+256GB 钛色 国家补贴 蔡司2亿APO超级长焦 蓝晶×天玑9400 6000mAh蓝海电池手机
22221113296,"媳妇用的flip, 本来自己用的水果，但是觉得媳妇的vivo手机和平板挺好用，正好需要换机了，置换了200pro，很流畅，拍照效果非常强大，随便拍都好看！",2025-01-13 08:12:14,0,1,5,2025-01-14 20:01:19,vivo X200 Pro 12GB+256GB 钛色 国家补贴 蔡司2亿APO超级长焦 蓝晶×天玑9400 6000mAh蓝海电池手机
21913228013,最近换了vivo200pro性能很不错，拍照也很清晰用的蔡司镜头拍人拍景很好看，在加天玑9400的配置杠杠的，运行速度快，外观也好看，手感非常好，个人觉得不带手机壳手感好，带了手机壳手感一般般，但是新机怕摔就带了手机壳，。可以入手,2024-11-29 22:45:08,0,1,5,2024-12-08 21:02:21,vivo X200 Pro 12GB+256GB 钛色 国家补贴 蔡司2亿APO超级长焦 蓝晶×天玑9400 6000mAh蓝海电池手机
22047483129,"这款 VIVO X200POR 手机真的太让我满意了！

首先，外观设计非常时尚，线条流畅，握在手里的质感特别好，颜色也很高级，完全符合我的审美。屏幕显示效果极其出色，色彩鲜艳、清晰，无论是看电影还是玩游戏，都能带来极致的视觉享受。

性能方面更是强大得没话说。运行速度超快，各种应用都能瞬间打开，多任务处理也毫无压力，丝毫没有卡顿的情况。手机的存储容量也很大，我可以随心所欲地存储照片、视频和各种文件，再也不用担心空间不够了。

拍照功能更是惊艳到我。后置摄像头拍出的照片清晰细腻，色彩还原度高，无论是风景还是人物，都能拍出大片的感觉。前置摄像头的自拍效果也很棒，自带美颜效果自然又好看，让我爱不释手。

电池续航能力也让我很惊喜，正常使用一整天完全没问题，而且充电速度也很快，大大节省了我的时间。

系统操作简单易懂，容易上手，各种功能齐全且实用。而且 VIVO 的售后服务也让人放心，有任何问题都能得到及时的解决。

总之，这次购买 VIVO X200POR 手机是一次非常愉快的购物体验，性价比超高，强烈推荐给大家！",2024-12-31 21:18:00,0,1,5,2025-01-02 18:38:35,vivo X200 Pro 12GB+256GB 钛色 国家补贴 蔡司2亿APO超级长焦 蓝晶×天玑9400 6000mAh蓝海电池手机
21984638520,"外形外观：颜色好看，
拍照效果：拍远处很清晰
运行速度：很流畅手感很好
待机时间：待使用后再说
其他特色：颜值很高，内存很大，适合多拍照，大小也合适。",2024-12-21 12:16:26,0,1,5,2024-12-22 19:04:51,vivo X200 Pro 12GB+256GB 钛色 国家补贴 蔡司2亿APO超级长焦 蓝晶×天玑9400 6000mAh蓝海电池手机
22251870858,入手了这款手机，体验超棒！外观简约又时尚，拿在手上很有质感。屏幕显示清晰细腻，色彩还原度超高，看着就舒服。运行速度更是没得说，各种软件秒开，玩游戏也毫无卡顿，流畅到飞起。拍照效果也惊艳，不管是拍风景还是人像，都能拍出大片既视感。而且物流超快，包装严实，总之很满意这次购物，必须好评！,2025-01-15 23:16:29,0,1,5,2025-01-16 19:13:27,vivo X200 Pro 12GB+256GB 钛色 国家补贴 蔡司2亿APO超级长焦 蓝晶×天玑9400 6000mAh蓝海电池手机
22146659155,"白色款非常简洁好看(&hearts;&forall;&hearts;)电池续航也很棒，白天上班不怎么用，24h充电一次就够了。
手机宽度对女生来说也刚好，两只手使用更有安全感。
触摸非常灵敏。买了最大内存，给娃拍照拍视频没有内存焦虑。用了国补，省钱了。",2025-01-04 18:52:51,0,0,5,2025-01-09 20:40:25,vivo X200 Pro 12GB+256GB 钛色 国家补贴 蔡司2亿APO超级长焦 蓝晶×天玑9400 6000mAh蓝海电池手机
21984322916,"手机昨天下的单，今天就收到了，包装的很好！开机后运行速度很快！
外形外观：很漂亮！
屏幕音效：音效很好！
拍照效果：很给力！",2024-12-21 14:31:23,0,1,5,2024-12-22 18:29:45,vivo X200 Pro 12GB+256GB 钛色 国家补贴 蔡司2亿APO超级长焦 蓝晶×天玑9400 6000mAh蓝海电池手机
22328086502,"拍照效果：好
运行速度：快
待机时间：长
屏幕音效：帅
外形外观：靓
颜值担当～手感不错～拍照色彩很正～值得入手～哇偶～家里老人人手一个～不错呦～",2025-01-27 11:15:28,0,1,5,2025-01-28 17:22:41,vivo X200 Pro 12GB+256GB 钛色 国家补贴 蔡司2亿APO超级长焦 蓝晶×天玑9400 6000mAh蓝海电池手机
22259796269,"外形外观：超级完美，非常好看
屏幕音效：画画很美，很清晰。
拍照效果：像素很高清晰度特别的好。
运行速度：这一代9400性能很强，温控做的很好
待机时间：待机时间非常长，兰海电池特别好",2025-01-16 11:46:03,0,1,5,2025-01-17 14:50:37,vivo X200 Pro 12GB+256GB 钛色 国家补贴 蔡司2亿APO超级长焦 蓝晶×天玑9400 6000mAh蓝海电池手机
22314360086,选了很久的手机，看中了X200PRO，国补一到马上入手。果然没让我失望，做工，系统，拍照，都是一流。京东物流也很快，第二天就到啦，过年前用上了新手机舒服,2025-01-22 18:42:49,0,1,5,2025-01-24 11:41:50,vivo X200 Pro 12GB+256GB 钛色 国家补贴 蔡司2亿APO超级长焦 蓝晶×天玑9400 6000mAh蓝海电池手机
21985676347,"外形外观：以前都是用直屏，还担心微曲屏用不习惯，感觉和直屏差不多，上手摸着挺好的。蓝色这款很好看。

拍照效果：买这个就是为了看演唱会拍照，长焦真的超级超级厉害，演唱会神器。

运行速度：很快
屏幕音效：很好，语言无法形容。",2024-12-12 12:59:21,0,1,5,2024-12-22 20:54:16,vivo X200 Pro 12GB+256GB 钛色 国家补贴 蔡司2亿APO超级长焦 蓝晶×天玑9400 6000mAh蓝海电池手机
22029068997,这款手机简直太棒了！操作流畅，OriginOS 5系统让人眼前一亮，AI功能实用便捷。拍照效果尤其出色，尽管前置摄像头是固定焦距有些遗憾，但总体来说，屏幕显示效果调整后非常舒适，使用体验极佳，强烈推荐！,2024-12-27 19:49:34,0,1,5,2024-12-30 10:06:50,vivo X200 Pro 12GB+256GB 钛色 国家补贴 蔡司2亿APO超级长焦 蓝晶×天玑9400 6000mAh蓝海电池手机
22264189061,"弟弟用的100pro，然后强烈推荐的这款200pro，也对比了其他友商，综合考虑选择了200pro，收到货之后拍照太惊艳了，对于女生无法抗拒，颜值手感都很喜欢，刷新对vivo的认知，以后换机会继续用咱家~
拍照效果：完美
外形外观：简约大气
待机时间：一天正常使用才消耗了43%的电量",2025-01-10 15:48:51,0,1,5,2025-01-18 12:40:11,vivo X200 Pro 12GB+256GB 钛色 国家补贴 蔡司2亿APO超级长焦 蓝晶×天玑9400 6000mAh蓝海电池手机
21980373701,第一次用蓝厂手机，包装很好，钛色也很好看，外观没有瑕疵，影像方面没在大太阳下和强光下拍照，炫光也一直没出现，毕竟刚入手，问题得等用一阵子才能知道，目前来说一切安好。,2024-12-20 14:28:22,0,1,5,2024-12-22 00:10:12,vivo X200 Pro 12GB+256GB 钛色 国家补贴 蔡司2亿APO超级长焦 蓝晶×天玑9400 6000mAh蓝海电池手机
21981766736,"外形外观：白月光配色很推荐很好看

拍照效果：拍照摄影就一个字牛，4k120帧视频太丝滑了

运行速度：天玑9400也是旗舰芯片了完全没问题

其他特色：橘子系统确实丝滑，等下升级个系统看看。信号也好，比我之前的iPhone强太多了，好评！",2024-12-21 13:44:45,0,1,5,2024-12-22 11:47:28,vivo X200 Pro 12GB+256GB 钛色 国家补贴 蔡司2亿APO超级长焦 蓝晶×天玑9400 6000mAh蓝海电池手机
22318002709,外观漂亮、高端、大气、上档次，手感舒适，四等宽屏幕显示效果通透、细腻，长焦拍照、微距拍照成片效果非常完美，物有所值，值得购买！,2025-01-15 02:22:31,0,1,5,2025-01-25 09:10:19,vivo X200 Pro 12GB+256GB 钛色 国家补贴 蔡司2亿APO超级长焦 蓝晶×天玑9400 6000mAh蓝海电池手机
22315049743,"外形外观：非常精美，白色百搭
屏幕音效：很好
拍照效果：效果太好了，无论自拍还是拍物都很好看
运行速度：很快
待机时间：耐用
其他特色：总之很满意，国产机中做的
比较好的",2025-01-22 21:27:53,0,1,5,2025-01-24 14:55:24,vivo X200 Pro 12GB+256GB 钛色 国家补贴 蔡司2亿APO超级长焦 蓝晶×天玑9400 6000mAh蓝海电池手机
