userId,content,boughtTime,voteCount,replyCount,starStep,creationTime,referenceName
22350469525,vivo X200 Pro 的卫星通信板真的太强大了！无论是户外探险还是紧急情况，都能随时保持通信畅通，信号稳定又可靠，真正做到了科技与安全的完美结合！,2025-02-02 23:03:10,0,0,5,2025-02-07 17:09:30,vivo X200 Pro 12GB+256GB 钛色 国家补贴 蔡司2亿APO超级长焦 蓝晶×天玑9400 6000mAh蓝海电池手机
22399381573,本来用的是iqoo12，都很满意，特别是系统。X200系列发布后，心里就中了草了，终于抢了首发。首先，摄影很牛，也好用，拿到后拍了几张，真的很舒服。其次，系统升级了5，想先体验。再次，无网通话，又是创新，好，支持。第四，据说待机很牛。第五，手机很漂亮，整体协调，其他的优点多多，首发活动以旧换新等力度也满意。用了不会后悔。,2024-12-27 07:57:30,0,0,5,2025-02-19 03:15:10,vivo X200 Pro 12GB+256GB 钛色 国家补贴 蔡司2亿APO超级长焦 蓝晶×天玑9400 6000mAh蓝海电池手机
22479818127,在别人朋友圈看过这品牌的照片觉得不错，这哈次决定给家里人华为换过来试试，拿到货试了下拍照确实很不错，可以说超过了很多卡片机了，有国补性价比确实不错，送的手机壳，拆包装就贴好膜的,2025-03-01 18:45:58,0,0,5,2025-03-02 20:11:56,vivo X200 Pro 12GB+256GB 钛色 国家补贴 蔡司2亿APO超级长焦 蓝晶×天玑9400 6000mAh蓝海电池手机
22354773641,手机收到了 很喜欢 颜值质感都很好👍据说是拍照最好的手机 AI算法很不错 以后拍月亮不在话下 开心心🥳,2025-02-04 12:33:32,0,1,5,2025-02-08 18:21:01,vivo X200 Pro 12GB+256GB 钛色 国家补贴 蔡司2亿APO超级长焦 蓝晶×天玑9400 6000mAh蓝海电池手机
22347578719,之前用的苹果手机，纠结了好久最终决定了这个手机，拍照是真的强，遇到炫光的概率也很低，对于网上说的缺点感觉就是凭空捏造，我觉得挺不错的，系统也很流畅,2025-02-02 17:39:53,0,0,5,2025-02-06 21:23:34,vivo X200 Pro 12GB+256GB 钛色 国家补贴 蔡司2亿APO超级长焦 蓝晶×天玑9400 6000mAh蓝海电池手机
22341165035,观望了很久了，终于买了，VIVO的拍照是遥遥领先的，这点不用质疑，而且品控绝对是第一梯队。喜欢的可以下单，一直都是用vivo手机，加油加油加油。,2025-01-26 00:19:10,0,0,5,2025-02-05 11:18:03,vivo X200 Pro 12GB+256GB 钛色 国家补贴 蔡司2亿APO超级长焦 蓝晶×天玑9400 6000mAh蓝海电池手机
22343075857,外形外观：这款产品的质量和外观设计都非常出色，完全超出我的预期。卖家的服务态度也非常好，解答问题耐心细致。发货速度快，包装完好无损。整体非常满意！,2025-02-02 00:25:49,0,0,5,2025-02-05 17:47:20,vivo X200 Pro 12GB+256GB 钛色 国家补贴 蔡司2亿APO超级长焦 蓝晶×天玑9400 6000mAh蓝海电池手机
22345607481,产品真的超级棒，下次还会买的，愿越做越好，非常好的购物体验挺好的，价格适中，质量看着不错品质很不错🍆，性价比比较高的的商品🍀，喜欢的亲可以直接下手不要犹豫哦📍这款商品的质量真的很棒！外观时尚，内在实用，而且质量过硬，太喜欢了！,2025-01-21 14:56:30,0,0,5,2025-02-06 13:54:15,vivo X200 Pro 12GB+256GB 钛色 国家补贴 蔡司2亿APO超级长焦 蓝晶×天玑9400 6000mAh蓝海电池手机
22373102345,京东购物的体验一直都很好，不管是自营的还是非自营的店铺，客服的态度都很好，快递小哥也是，快递快还能送货上门，商品质量把关的也很好，好评。,2025-01-19 10:06:51,0,1,5,2025-02-13 09:02:44,vivo X200 Pro 12GB+256GB 钛色 国家补贴 蔡司2亿APO超级长焦 蓝晶×天玑9400 6000mAh蓝海电池手机
22345886771,vivo手机性价比超高，各项功能都相当出色。商家态度热情，售后有保障，使用过程中遇到问题也能得到及时解决，值得推荐！,2025-02-05 00:30:24,0,0,5,2025-02-06 15:18:52,vivo X200 Pro 12GB+256GB 钛色 国家补贴 蔡司2亿APO超级长焦 蓝晶×天玑9400 6000mAh蓝海电池手机
22479102433,非常满意的一次购物体验！卖家的发货速度超乎想象，简直可以用神速来形容。服务态度更是让人暖心，对待每一个疑问都耐心解答，这样的商家实属难得。强烈推荐给大家，五星好评无疑！,2025-02-23 12:18:33,0,0,5,2025-03-02 17:12:04,vivo X200 Pro 12GB+256GB 钛色 国家补贴 蔡司2亿APO超级长焦 蓝晶×天玑9400 6000mAh蓝海电池手机
22367994386,不得不夸赞一下，商品不仅价格美丽，质量更是一流。物流超快，商家服务优质，售后完善。五星好评，非常好！想不到那么快就到了！,2025-02-07 21:47:31,0,1,5,2025-02-11 22:17:07,vivo X200 Pro 12GB+256GB 钛色 国家补贴 蔡司2亿APO超级长焦 蓝晶×天玑9400 6000mAh蓝海电池手机
22343961881,vivo手机内存大，超大容量。机子用起来很流畅，没有卡顿现象，无论听音乐还是看电视剧或者看电影音质很好，图像清楚，照相像素清晰,2025-01-23 21:50:02,0,0,5,2025-02-05 21:31:55,vivo X200 Pro 12GB+256GB 钛色 国家补贴 蔡司2亿APO超级长焦 蓝晶×天玑9400 6000mAh蓝海电池手机
22434569689,东西收到了，发货速度很快，卖家客服耐心有礼貌，包包装非常仔细、严实，物流公司服务态度很好，运送速度很快，很满意的一次购物。,2025-02-20 19:22:12,0,0,5,2025-02-24 19:47:35,vivo X200 Pro 12GB+256GB 钛色 国家补贴 蔡司2亿APO超级长焦 蓝晶×天玑9400 6000mAh蓝海电池手机
22453649293,包装好，物流快，价格实惠，比超市便宜多了包装好，物流快，价格实惠，比超市便宜多了卖家服务态度很好物流很快,2025-02-26 19:44:02,0,0,5,2025-02-27 14:14:14,vivo X200 Pro 12GB+256GB 钛色 国家补贴 蔡司2亿APO超级长焦 蓝晶×天玑9400 6000mAh蓝海电池手机
22490887887,我这次买的是白月光版本，非常的喜欢，白色永不过时，1t的内存非常够用，可以存储非常多的视频照片，蓝厂加天玑非常丝滑，打游戏一点都不卡。最最最有特色的就是本次的两亿潜望长焦简直比我眼睛都看的清楚。总体非常OK 。,2025-03-02 21:09:30,0,0,5,2025-03-04 06:08:43,vivo X200 Pro 12GB+256GB 钛色 国家补贴 蔡司2亿APO超级长焦 蓝晶×天玑9400 6000mAh蓝海电池手机
22361012478,X200Pro系统流畅，丝滑，重量适中，握持手感非常好，小手也不费劲。超声波指纹解锁，真的是谁用谁说好，解锁速度快，位置适中更方便解锁，微曲面屏绝对比直面屏好，又高级又好用，那种弧线过渡是直面屏无法比拟的。屏幕显示细腻，色彩鲜艳。最棒的还得是影像系统，普通拍，人像拍真的是张张大片，长焦清晰的就像望远镜，性能超预期。vivo x200pro真的是一款非常值得推荐的手机，无论是日常使用还是娱乐需求都能轻松应对！。,2025-02-05 13:21:20,0,1,5,2025-02-10 13:01:41,vivo X200 Pro 12GB+256GB 钛色 国家补贴 蔡司2亿APO超级长焦 蓝晶×天玑9400 6000mAh蓝海电池手机
21692949663,总体来讲东西可以，摄像头还是可以的，但是摄像头组模太大，影响玩游戏，日常用肯定够。,2024-10-22 23:25:49,2,1,3,2024-11-03 15:21:02,vivo X200 Pro 12GB+256GB 钛色 国家补贴 蔡司2亿APO超级长焦 蓝晶×天玑9400 6000mAh蓝海电池手机
22398348702,观察了好久，趁着国补活动，把原来的 X90s 以旧换新，京东速度没得说，第二天就送过来啦😊，非常给力的一款手机👍,2025-02-16 15:47:35,0,0,5,2025-02-18 20:46:02,vivo X200 Pro 12GB+256GB 钛色 国家补贴 蔡司2亿APO超级长焦 蓝晶×天玑9400 6000mAh蓝海电池手机
22370928711,机器非常好，拍照很厉害。续航优秀，系统稳定，京东送货也非常快！前天晚上原手机摔坏下的单，第二天早上就到了。,2025-02-03 21:58:18,0,1,5,2025-02-12 16:28:57,vivo X200 Pro 12GB+256GB 钛色 国家补贴 蔡司2亿APO超级长焦 蓝晶×天玑9400 6000mAh蓝海电池手机
22423273969,我非常喜欢这件商品，宝贝的质量超乎想象的好，真是物超所值。卖家的服务态度也非常好，包装仔细，发货迅速。我会继续支持这家店铺，并且会推荐给我的朋友们。非常满意的一次购物体验！用上ai当然要试下ai好评助手哦，拍微距实物风景都很好，赞,2025-01-25 08:53:27,0,0,5,2025-02-22 14:59:02,vivo X200 Pro 12GB+256GB 钛色 国家补贴 蔡司2亿APO超级长焦 蓝晶×天玑9400 6000mAh蓝海电池手机
22377723264,价格很实惠，性价比很高，算是平价好物，会回购的宝贝收到了，太惊喜了，质量非常好，性价比很高，真是出乎我的意料！非常满意的一次购物，产品外观和质量都很棒，物流速度快，商家服务专业。,2025-01-19 00:19:57,0,0,5,2025-02-14 10:15:25,vivo X200 Pro 12GB+256GB 钛色 国家补贴 蔡司2亿APO超级长焦 蓝晶×天玑9400 6000mAh蓝海电池手机
22357022357,橘子5系统很流畅，灵动岛很方便，长焦清晰度要比x100好很多。有丰富的风光摄影模式，特别喜欢拍人像的，新增的的135mm的模式很好用。还有就是微距真的很强大，摄影爱好者必不可少的功能。2亿长焦镜头模组太大了。骁龙9400能耗比也好，满足续航需求，总之推荐购买。,2025-02-07 11:47:55,0,1,5,2025-02-09 12:03:29,vivo X200 Pro 12GB+256GB 钛色 国家补贴 蔡司2亿APO超级长焦 蓝晶×天玑9400 6000mAh蓝海电池手机
22347718467,商品质量无可挑剔，价格亲民，真是物超所值。物流顺畅，商家服务贴心，售后有保障，太棒了！买到了心仪的商品，物美价廉，质量好得没话说。物流顺畅，商家服务细致，售后服务靠谱。客服服务态度很好，快递也不赖，希望老板生意越来越好！！！🌈质量很好，买的很合我心意💕，棒棒哒！✨需要的亲们可以放心购买,2025-01-28 23:12:05,0,0,5,2025-02-06 22:11:23,vivo X200 Pro 12GB+256GB 钛色 国家补贴 蔡司2亿APO超级长焦 蓝晶×天玑9400 6000mAh蓝海电池手机
22427841300,这次购物非常愉快！商品实惠好用，质量上乘。物流迅速，商家服务热情，售后无忧。真没想到，这么便宜能买到这么好质量的东西。商家太良心了，必须给个大大的好评！实物与描述的一样，质量相当好，卖家态度也好，有问必答，发货速度杠杠的，值得购买哦,2025-02-20 07:32:34,0,0,5,2025-02-23 16:25:43,vivo X200 Pro 12GB+256GB 钛色 国家补贴 蔡司2亿APO超级长焦 蓝晶×天玑9400 6000mAh蓝海电池手机
22382585698,手机收到了，物流发货很快。手机是官方正品。运行速度很快，拍照也满意，续航也是超预期表现，重度一天无压力，充电速度也飞快，使用体验很稳。很喜欢的一个手机,2025-02-02 17:48:36,0,0,5,2025-02-15 12:24:09,vivo X200 Pro 12GB+256GB 钛色 国家补贴 蔡司2亿APO超级长焦 蓝晶×天玑9400 6000mAh蓝海电池手机
22347269128,"在换机前用的vivoX90s,性价比极高，3000多块钱，运行速度待机都还不错，今年想换个更好点的，x90s在使用过程中感受非常好，所以还是想选择vivo手机，最初看的是升级款x100s,又看了pro，最后决定多添点上个灭霸x100Ultra，一步到位，感受下旗舰的魅力，正准备下单时看到预售x200的宣传，一看日期，没几天就是发布会，正好看看x200有啥进步。终于等到发布会当天，看到x200无论是cpu，屏幕，照相，速度，都有非常大的升级，果断下单x200pro.经过几天的等待，终于拿到心心念念的x200pro，首先给我的感受是，蓝色真漂亮，机身很薄，翻页丝滑不输苹果，蔡司两亿长焦，索尼lyt-818一改x90s摄像照相的不足，照像效果是我用过手机最好的，再配上长焦，真是想拍啥就拍啥，微曲屏也是把x100Ultra唯一的屏幕小遗憾改进了，6000毫安的大电池更是让待机时间翻倍，机器还很薄，堪称安卓手机完美版。",2025-02-03 00:03:18,0,0,5,2025-02-06 19:50:16,vivo X200 Pro 12GB+256GB 钛色 国家补贴 蔡司2亿APO超级长焦 蓝晶×天玑9400 6000mAh蓝海电池手机
22415730384,"这次购物超级满意，商品实惠好用，质量绝佳。物流高效，商家服务热情，售后无忧。跟描述的是一样的，很显高档，物美价廉，要买的朋友可以一起下单！质量非常好，完全超出期望值，发货速度非常快，包装非常仔细、严实，很满意的一次购物
和100u差不多。跑分高点。摄像头卡手",2025-02-20 10:52:01,0,0,5,2025-02-21 14:27:29,vivo X200 Pro 12GB+256GB 钛色 国家补贴 蔡司2亿APO超级长焦 蓝晶×天玑9400 6000mAh蓝海电池手机
22345373901,1外形外观：宝石蓝的外观非常漂亮，不同角度色彩会不一样，真的很喜欢这种感觉～1运行速度：平时不玩手机游戏12G内存足够了，系统运行流畅后台切换app很丝滑～1待机时间：买来做手机摄影备机的，不高强度刷视频，3天依然电量够用～,2025-02-05 14:46:28,0,0,5,2025-02-06 12:35:42,vivo X200 Pro 12GB+256GB 钛色 国家补贴 蔡司2亿APO超级长焦 蓝晶×天玑9400 6000mAh蓝海电池手机
22479584187,"物超所值，话不多说，这四个字已经说明了一切
买到了物美价廉的好物，质量出色。物流迅速，商家服务周到，售后放心。
拍照非常好",2025-02-07 10:09:27,0,0,5,2025-03-02 19:11:33,vivo X200 Pro 12GB+256GB 钛色 国家补贴 蔡司2亿APO超级长焦 蓝晶×天玑9400 6000mAh蓝海电池手机
22370779748,vivo X200 Pro棒极了！外观全等深微四曲面设计精致且手感好。天玑9400芯片性能强劲。影像系统超厉害，蔡司镜头与影像芯片助力拍出佳片。OriginOS 5系统实用。还有大容量电池、快充、支持NFC等诸多优点，物超所值。,2025-01-27 20:56:10,0,0,5,2025-02-12 16:06:04,vivo X200 Pro 12GB+256GB 钛色 国家补贴 蔡司2亿APO超级长焦 蓝晶×天玑9400 6000mAh蓝海电池手机
22341514541,质量非常好，完全超出期望值，发货速度非常快，包装非常仔细、严实，很满意的一次购物超出预期，质量很好，做工精细，满意,2025-02-04 16:25:59,0,0,5,2025-02-05 12:20:29,vivo X200 Pro 12GB+256GB 钛色 国家补贴 蔡司2亿APO超级长焦 蓝晶×天玑9400 6000mAh蓝海电池手机
22342949758,质量非常好，完全超出期望值，发货速度非常快，包装非常仔细、严实，很满意的一次购物这次购物太满意了，商品性价比超高，质量上乘。物流高效，商家服务贴心，售后无忧。发货很快，已经收到货了，商品和描述的差不多，质量没问题，关键价格也合适，在这里买还是很放心的，好评！,2025-02-05 09:48:38,0,0,5,2025-02-05 17:22:58,vivo X200 Pro 12GB+256GB 钛色 国家补贴 蔡司2亿APO超级长焦 蓝晶×天玑9400 6000mAh蓝海电池手机
22368214339,"外形外观：外观很酷，很好看
拍照效果：拍照效果绝对超赞，主打就是拍照好看🤩
运行速度：运行速度很快
待机时间：待机时间也很长！
总的来说，拍照需要，这款手机首选👍",2025-02-02 23:43:54,0,1,5,2025-02-11 23:43:26,vivo X200 Pro 12GB+256GB 钛色 国家补贴 蔡司2亿APO超级长焦 蓝晶×天玑9400 6000mAh蓝海电池手机
22447642355,一次很好的购物体验，服务周到，物流快速，配送也很周到，态度也很好，好评！跟描述的是一样的，很显高档，物美价廉，要买的朋友可以下单噢！国补补贴很给力,2025-01-28 18:51:05,0,0,5,2025-02-26 20:06:56,vivo X200 Pro 12GB+256GB 钛色 国家补贴 蔡司2亿APO超级长焦 蓝晶×天玑9400 6000mAh蓝海电池手机
22477043043,我对这次的购物体验非常满意。产品的性价比实在是高，不仅价格合理，而且质量也非常好，完全超出了我的期望。我强烈推荐给大家，绝对值得购买。,2025-02-28 22:41:43,0,0,5,2025-03-02 10:05:11,vivo X200 Pro 12GB+256GB 钛色 国家补贴 蔡司2亿APO超级长焦 蓝晶×天玑9400 6000mAh蓝海电池手机
22362328008,商品质量超棒，完全超出了我的预期！价格实惠，用国家补贴性价比超高。主打一个拍照功能，人文街拍氛围感的神！,2025-01-20 12:48:37,0,1,5,2025-02-10 17:47:20,vivo X200 Pro 12GB+256GB 钛色 国家补贴 蔡司2亿APO超级长焦 蓝晶×天玑9400 6000mAh蓝海电池手机
22354128732,"外形外观：轻巧手握感舒适。
拍照效果：拍照效果真是绝了👍完全超出预期！！超微距的成片细节满分💯细节拉满💯自带的拍照模式和滤镜可以直接出片，完全不用后期调色的感觉简直不要太爽❤️",2025-01-30 12:31:30,0,0,5,2025-02-08 15:51:20,vivo X200 Pro 12GB+256GB 钛色 国家补贴 蔡司2亿APO超级长焦 蓝晶×天玑9400 6000mAh蓝海电池手机
22356942672,我非常满意这次的购物体验！宝贝的质量超乎想象，用起来非常舒适，感觉物超所值。卖家的服务也很周到，发货速度很快。我会继续支持这家店铺，并且推荐给我的朋友们。期待下一次的购物！,2025-02-03 14:29:50,0,1,5,2025-02-09 11:40:23,vivo X200 Pro 12GB+256GB 钛色 国家补贴 蔡司2亿APO超级长焦 蓝晶×天玑9400 6000mAh蓝海电池手机
22374389863,"手机的背面采用了独特的玻璃材质, 不仅美观, 还提供
了良好的握持感。 手机的厚度和重量都控制得恰到好
处,即使长时间使用也不会感到手腕疲劳。
显示屏: 这款手机配备了一块6.78英寸1.5k的屏幕,显
示效果非常出色。 色彩鲜艳,屏占比明显好于上一代
性能: 搭载了最新的天现9400, 目前玩王者吃鸡非常顺
畅, 而且温度控制的很好
相机: 拍夜景很清晰, 拍人像也不错
电池续航: 6000的大电池基本上可以做到一天一充了非
常适合上班人群
软件体验: originOS5 目前调教的也还不错, 顺利登
岛, 后续再熟悉下功能。",2025-02-12 08:49:55,0,0,5,2025-02-13 14:11:46,vivo X200 Pro 12GB+256GB 钛色 国家补贴 蔡司2亿APO超级长焦 蓝晶×天玑9400 6000mAh蓝海电池手机
22419681139,vivo x200pro真的是太棒了!它的影像能力超级出色，拍出来的照片和视频都超级清晰，色彩还原度也很高。而且它的系统体验也非常流畅，橘子5果然名不虚传!!无论是打开应用还是切换任务都非常迅速，再也不是烂橘子了。细节处理和性能优化都做得非常好。它的屏幕显示效果也超级棒，色彩鲜艳且对比度高，观看视频或者玩游戏都爽的一批~~电池续航能力也相当不错，能够满足一整天的使用，一天一充完全没问题。总之，vivo x200pro真的是一款非常值得推荐的手机，无论是日常使用还是娱乐需求都能轻松应,2025-02-19 16:36:04,0,0,5,2025-02-21 23:29:14,vivo X200 Pro 12GB+256GB 钛色 国家补贴 蔡司2亿APO超级长焦 蓝晶×天玑9400 6000mAh蓝海电池手机
22411864061,"外形外观：有质感。
屏幕音效：可以，但低音不太理想。
拍照效果：拍远处清晰，夜景效果好。
运行速度：流畅。
待机时间：耐用。
其他特色：主打拍照，玩游戏也行，就是摄像头太大，重，手感差，放手不好放。",2025-02-18 03:07:13,0,0,5,2025-02-20 20:36:06,vivo X200 Pro 12GB+256GB 钛色 国家补贴 蔡司2亿APO超级长焦 蓝晶×天玑9400 6000mAh蓝海电池手机
22387065260,怎么这么热🥵，我的iPhone充电都不带这么烫的，这个摄像头模组这么大的嘛，前置摄像头还是不尽人意,2025-02-15 14:25:35,0,1,3,2025-02-16 15:29:22,vivo X200 Pro 12GB+256GB 钛色 国家补贴 蔡司2亿APO超级长焦 蓝晶×天玑9400 6000mAh蓝海电池手机
22401876651,"外形外观：很耐看，推荐白色或者是黑色
屏幕音效：还可以
拍照效果：遥遥领先，全焦段都还好，画质高，视频录制安卓第一梯队
运行速度：比较稳定，目前没遇到大问题
待机时间：续航好",2025-01-16 15:42:06,0,0,5,2025-02-19 13:52:21,vivo X200 Pro 12GB+256GB 钛色 国家补贴 蔡司2亿APO超级长焦 蓝晶×天玑9400 6000mAh蓝海电池手机
22376715832,Vivo X 200 Pro 影像系统是一大亮点，搭载与索尼联合定义的蓝图 &times; 索尼 LYT-818 传感器及 vivo 自研蓝图传感器技术，拥有强大影像实力。2 亿像素潜望长焦镜头支持 100 倍变焦，远景、微距拍摄清晰。新增长焦人像运动抓拍功能，实时捕捉运动瞬间，提升人像拍摄成功率。视频拍摄支持 4K 120fps 电影慢动作和全焦段 10bit Log 视频录制，专业水准高。性能方面，首发天玑 9400 旗舰芯片，安兔兔跑分 292 万，日常使用和大型 3A 游戏轻松应对。配备 LPDDR5T Ultra Pro 内存和 UFS 4.0 闪存，性能铁三角确保流畅体验。屏幕采用全等深微四曲屏设计，外观时尚，支持 2160Hz 高频 PWM 调光护眼。续航充电优势明显，6000mAh 大容量电池，重度使用续航出色。5 小时重度续航测试后电量剩余 67%。支持 90W 有线闪充和 30W 无线充电，充电速度快。细节方面，支持超声波指纹解锁，解锁快且准；信号表现优秀，WiFi 和移动网络连接稳定。综合来看，Vivo X 200 Pro 影像与性能兼备，旗舰手机竞争力强。,2025-02-05 11:59:19,0,1,5,2025-02-13 23:10:52,vivo X200 Pro 12GB+256GB 钛色 国家补贴 蔡司2亿APO超级长焦 蓝晶×天玑9400 6000mAh蓝海电池手机
22343459646,"外形外观：中规中矩
屏幕音效：悦耳动听
拍照效果：自带修图
运行速度：快
待机时间：快
其他特色：镜头比较重，拿在手上不平衡，充电很快",2025-01-28 17:52:59,0,0,4,2025-02-05 19:15:12,vivo X200 Pro 12GB+256GB 钛色 国家补贴 蔡司2亿APO超级长焦 蓝晶×天玑9400 6000mAh蓝海电池手机
22340907288,用惯了橘子系统，续航挺强的，大概四五十分钟充满，比旧手机iQOO120w的稍慢，早上九点半充满，不玩游戏也就刷刷视频，到第二天早上还有二十多的电，影像对比旧手机挺强的，成片应该算法处理了，炫光目前拍摄的角度还没遇到，总体挺满意的,2025-01-31 00:33:22,0,0,5,2025-02-05 10:15:57,vivo X200 Pro 12GB+256GB 钛色 国家补贴 蔡司2亿APO超级长焦 蓝晶×天玑9400 6000mAh蓝海电池手机
22416256639,"买回来用了有一段时间了，vivo X200是一款集时尚设计与强大性能于一体的智能手机。其外观采用了流线型设计，搭配细腻的玻璃背板，手感舒适且极具质感。屏幕方面，X200配备了一块6.5英寸的AMOLED显示屏，色彩鲜艳，对比度高，支持高刷新率，无论是日常使用还是游戏娱乐，都能带来流畅的视觉体验。
性能上，vivo X200搭载了最新的处理器，配合大容量内存，运行速度快，多任务处理毫无压力。此外，其内置的5000mAh大电池支持快速充电，续航表现出色，满足全天候使用需求。
拍照方面，X200配备了后置三摄系统，主摄像头像素高达6400万，支持多种拍摄模式和AI场景识别，无论是白天还是夜晚，都能拍出清晰、细腻的照片。前置摄像头也具备出色的自拍效果，满足自己日常拍摄需求。
总的来说，vivo X200是一款兼具颜值与实力的手机，还是值得入手",2025-01-25 01:31:47,0,0,5,2025-02-21 15:32:01,vivo X200 Pro 12GB+256GB 钛色 国家补贴 蔡司2亿APO超级长焦 蓝晶×天玑9400 6000mAh蓝海电池手机
22349581950,"正好该换手机了，新机入手手感很好。
金属边框很漂亮，虽然镜头组大了点，手持感觉时上半部分会沉重些，在某书上看很多人吐嘲这点，个人感觉能接受，没有他们说得那么夸张。
入手的是钛色的，最初满意的是蓝色的内，但在实体店看了一下蓝色跟只跟白色比较容易粘指纹，最终还是选择了钛色，送的壳是透明的，套上去感觉不明显，就跟手持裸机一样。
今天阴天，拍了一下马路对面的广告牌，实际距离裸眼是看不清楚字的，但拍出来的图片里非常清晰，画质不糊。",2025-02-05 15:36:07,0,1,5,2025-02-07 14:33:58,vivo X200 Pro 12GB+256GB 钛色 国家补贴 蔡司2亿APO超级长焦 蓝晶×天玑9400 6000mAh蓝海电池手机
22442771172,影像功能非常强大，虽然是AI计算摄影的功劳，有些被震撼到。系统使用比较流畅，续航很顶，当副机能用2-3天，手感稍差一点，摄像头模组比较靠下，需要多适应适应,2025-02-10 03:24:07,0,0,5,2025-02-25 17:11:32,vivo X200 Pro 12GB+256GB 钛色 国家补贴 蔡司2亿APO超级长焦 蓝晶×天玑9400 6000mAh蓝海电池手机
22341079786,手机收到了，等深微曲设计特别好看又好用。长焦表现优越，适合拍摄远景。外观看着高级就是摄像模组有点大手感稍欠，机身稍重。不适合手小的用户。总体来说挺满意的，颜值高 拍照出色 性能均衡，适合追求高品质拍照的用户。,2025-02-04 18:43:35,0,0,5,2025-02-05 11:06:28,vivo X200 Pro 12GB+256GB 钛色 国家补贴 蔡司2亿APO超级长焦 蓝晶×天玑9400 6000mAh蓝海电池手机
22355399255,外观很漂亮，手感上除了摄像头有点重外没其他毛病，毕竟就是奔着摄像来的，性能也很不错，试了第五和王者之类的游戏都非常流畅！,2025-02-05 16:36:06,0,1,5,2025-02-08 21:11:53,vivo X200 Pro 12GB+256GB 钛色 国家补贴 蔡司2亿APO超级长焦 蓝晶×天玑9400 6000mAh蓝海电池手机
